,text,fromloc.city_name,depart_time.time,toloc.city_name,arrive_time.time,arrive_time.period_of_day,depart_date.day_name,depart_time.period_of_day,flight_time,cost_relative,round_trip,fare_amount,depart_date.today_relative,city_name,stoploc.city_name,toloc.airport_code,depart_time.time_relative,class_type,depart_date.date_relative,airline_name,arrive_time.time_relative,depart_time.start_time,depart_time.end_time,fromloc.airport_name,toloc.state_name,depart_date.day_number,depart_date.month_name,mod,fare_basis_code,transport_type,flight_mod,arrive_date.month_name,arrive_date.day_number,meal,toloc.state_code,meal_description,return_date.month_name,return_date.day_number,airline_code,depart_time.period_mod,flight_stop,fromloc.airport_code,arrive_date.day_name,time,or,economy,flight_number,arrive_time.period_mod,flight_days,toloc.airport_name,state_code,arrive_time.start_time,arrive_time.end_time,fromloc.state_name,arrive_date.date_relative,depart_date.year,return_date.date_relative,airport_code,aircraft_code,fromloc.state_code,connect,restriction_code,airport_name,toloc.country_name,days_code,day_name,period_of_day,today_relative,stoploc.state_code,meal_code,state_name,stoploc.airport_name,arrive_date.today_relative,time_relative,return_time.period_of_day,return_time.period_mod,month_name,day_number,return_date.today_relative,return_date.day_name
0,i want to fly from boston at 838 am and arrive in denver at 1110 in the morning,boston,838 am,denver,1110,morning,,,,,,,,,,,,,,,,,,,,,,,,,,,,,,,,,,,,,,,,,,,,,,,,,,,,,,,,,,,,,,,,,,,,,,,,,,
1,what flights are available from pittsburgh to baltimore on thursday morning,pittsburgh,,baltimore,,,thursday,morning,,,,,,,,,,,,,,,,,,,,,,,,,,,,,,,,,,,,,,,,,,,,,,,,,,,,,,,,,,,,,,,,,,,,,,,,
2,what is the arrival time in san francisco for the 755 am flight leaving washington,washington,755 am,,,,,,arrival time,,,,,,,,,,,,,,,,,,,,,,,,,,,,,,,,,,,,,,,,,,,,,,,,,,,,,,,,,,,,,,,,,,,,,,,
3,cheapest airfare from tacoma to orlando,tacoma,,orlando,,,,,,cheapest,,,,,,,,,,,,,,,,,,,,,,,,,,,,,,,,,,,,,,,,,,,,,,,,,,,,,,,,,,,,,,,,,,,,,,
4,round trip fares from pittsburgh to philadelphia under 1000 dollars,pittsburgh,,philadelphia,,,,,,under,round trip,1000 dollars,,,,,,,,,,,,,,,,,,,,,,,,,,,,,,,,,,,,,,,,,,,,,,,,,,,,,,,,,,,,,,,,,,,,
5,i need a flight tomorrow from columbus to minneapolis,columbus,,minneapolis,,,,,,,,,tomorrow,,,,,,,,,,,,,,,,,,,,,,,,,,,,,,,,,,,,,,,,,,,,,,,,,,,,,,,,,,,,,,,,,,,
6,what kind of aircraft is used on a flight from cleveland to dallas,cleveland,,dallas,,,,,,,,,,,,,,,,,,,,,,,,,,,,,,,,,,,,,,,,,,,,,,,,,,,,,,,,,,,,,,,,,,,,,,,,,,,,
7,show me the flights from pittsburgh to los angeles on thursday,pittsburgh,,los angeles,,,thursday,,,,,,,,,,,,,,,,,,,,,,,,,,,,,,,,,,,,,,,,,,,,,,,,,,,,,,,,,,,,,,,,,,,,,,,,,
8,all flights from boston to washington,boston,,washington,,,,,,,,,,,,,,,,,,,,,,,,,,,,,,,,,,,,,,,,,,,,,,,,,,,,,,,,,,,,,,,,,,,,,,,,,,,,
9,what kind of ground transportation is available in denver,,,,,,,,,,,,,denver,,,,,,,,,,,,,,,,,,,,,,,,,,,,,,,,,,,,,,,,,,,,,,,,,,,,,,,,,,,,,,,,,,
10,show me the flights from dallas to san francisco,dallas,,san francisco,,,,,,,,,,,,,,,,,,,,,,,,,,,,,,,,,,,,,,,,,,,,,,,,,,,,,,,,,,,,,,,,,,,,,,,,,,,,
11,show me the flights from san diego to newark by way of houston,san diego,,newark,,,,,,,,,,,houston,,,,,,,,,,,,,,,,,,,,,,,,,,,,,,,,,,,,,,,,,,,,,,,,,,,,,,,,,,,,,,,,,
12,what 's the airport at orlando,,,,,,,,,,,,,orlando,,,,,,,,,,,,,,,,,,,,,,,,,,,,,,,,,,,,,,,,,,,,,,,,,,,,,,,,,,,,,,,,,,
13,what is the cheapest flight from boston to bwi,boston,,,,,,,,cheapest,,,,,,bwi,,,,,,,,,,,,,,,,,,,,,,,,,,,,,,,,,,,,,,,,,,,,,,,,,,,,,,,,,,,,,,,,
14,all flights to baltimore after 6 pm,,6 pm,baltimore,,,,,,,,,,,,,after,,,,,,,,,,,,,,,,,,,,,,,,,,,,,,,,,,,,,,,,,,,,,,,,,,,,,,,,,,,,,,,
15,show me the first class fares from boston to denver,boston,,denver,,,,,,,,,,,,,,first class,,,,,,,,,,,,,,,,,,,,,,,,,,,,,,,,,,,,,,,,,,,,,,,,,,,,,,,,,,,,,,
16,show me the ground transportation in denver,,,,,,,,,,,,,denver,,,,,,,,,,,,,,,,,,,,,,,,,,,,,,,,,,,,,,,,,,,,,,,,,,,,,,,,,,,,,,,,,,
17,all flights from denver to pittsburgh leaving after 6 pm and before 7 pm,denver,7 pm,pittsburgh,,,,,,,,,,,,,before,,,,,,,,,,,,,,,,,,,,,,,,,,,,,,,,,,,,,,,,,,,,,,,,,,,,,,,,,,,,,,,
18,i need information on flights for tuesday leaving baltimore for dallas dallas to boston and boston to baltimore,boston,,baltimore,,,tuesday,,,,,,,,,,,,,,,,,,,,,,,,,,,,,,,,,,,,,,,,,,,,,,,,,,,,,,,,,,,,,,,,,,,,,,,,,
19,please give me the flights from boston to pittsburgh on thursday of next week,boston,,pittsburgh,,,thursday,,,,,,,,,,,,next,,,,,,,,,,,,,,,,,,,,,,,,,,,,,,,,,,,,,,,,,,,,,,,,,,,,,,,,,,,,,
20,i would like to fly from denver to pittsburgh on united airlines,denver,,pittsburgh,,,,,,,,,,,,,,,,united airlines,,,,,,,,,,,,,,,,,,,,,,,,,,,,,,,,,,,,,,,,,,,,,,,,,,,,,,,,,,,,
21,show me the flights from san diego to newark,san diego,,newark,,,,,,,,,,,,,,,,,,,,,,,,,,,,,,,,,,,,,,,,,,,,,,,,,,,,,,,,,,,,,,,,,,,,,,,,,,,,
22,please list all first class flights on united from denver to baltimore,denver,,baltimore,,,,,,,,,,,,,,first class,,united,,,,,,,,,,,,,,,,,,,,,,,,,,,,,,,,,,,,,,,,,,,,,,,,,,,,,,,,,,,,
23,what kinds of planes are used by american airlines,,,,,,,,,,,,,,,,,,,american airlines,,,,,,,,,,,,,,,,,,,,,,,,,,,,,,,,,,,,,,,,,,,,,,,,,,,,,,,,,,,,
24,i 'd like to have some information on a ticket from denver to pittsburgh and atlanta,denver,,atlanta,,,,,,,,,,,,,,,,,,,,,,,,,,,,,,,,,,,,,,,,,,,,,,,,,,,,,,,,,,,,,,,,,,,,,,,,,,,,
25,i 'd like to book a flight from atlanta to denver,atlanta,,denver,,,,,,,,,,,,,,,,,,,,,,,,,,,,,,,,,,,,,,,,,,,,,,,,,,,,,,,,,,,,,,,,,,,,,,,,,,,,
26,which airline serves denver pittsburgh and atlanta,atlanta,,,,,,,,,,,,,,,,,,,,,,,,,,,,,,,,,,,,,,,,,,,,,,,,,,,,,,,,,,,,,,,,,,,,,,,,,,,,,,
27,show me all flights from boston to pittsburgh on wednesday of next week which leave boston after 2 o'clock pm,boston,2 o'clock pm,pittsburgh,,,wednesday,,,,,,,,,,after,,next,,,,,,,,,,,,,,,,,,,,,,,,,,,,,,,,,,,,,,,,,,,,,,,,,,,,,,,,,,,,,
28,atlanta ground transportation,,,,,,,,,,,,,atlanta,,,,,,,,,,,,,,,,,,,,,,,,,,,,,,,,,,,,,,,,,,,,,,,,,,,,,,,,,,,,,,,,,,
29,i also need service from dallas to boston arriving by noon,dallas,,boston,noon,,,,,,,,,,,,,,,,by,,,,,,,,,,,,,,,,,,,,,,,,,,,,,,,,,,,,,,,,,,,,,,,,,,,,,,,,,,,
30,show me the cheapest round trip fare from baltimore to dallas,baltimore,,dallas,,,,,,cheapest,round trip,,,,,,,,,,,,,,,,,,,,,,,,,,,,,,,,,,,,,,,,,,,,,,,,,,,,,,,,,,,,,,,,,,,,,
31,show me all flights from new york to milwaukee on northwest airlines departing at 720 am,new york,720 am,milwaukee,,,,,,,,,,,,,,,,northwest airlines,,,,,,,,,,,,,,,,,,,,,,,,,,,,,,,,,,,,,,,,,,,,,,,,,,,,,,,,,,,,
32,flights from new york to miami,new york,,miami,,,,,,,,,,,,,,,,,,,,,,,,,,,,,,,,,,,,,,,,,,,,,,,,,,,,,,,,,,,,,,,,,,,,,,,,,,,,
33,please find a flight on delta from philadelphia to san francisco and give me the flight numbers,philadelphia,,san francisco,,,,,,,,,,,,,,,,delta,,,,,,,,,,,,,,,,,,,,,,,,,,,,,,,,,,,,,,,,,,,,,,,,,,,,,,,,,,,,
34,i need a flight from dallas to san francisco,dallas,,san francisco,,,,,,,,,,,,,,,,,,,,,,,,,,,,,,,,,,,,,,,,,,,,,,,,,,,,,,,,,,,,,,,,,,,,,,,,,,,,
35,fares and flights from pittsburgh to philadelphia,pittsburgh,,philadelphia,,,,,,,,,,,,,,,,,,,,,,,,,,,,,,,,,,,,,,,,,,,,,,,,,,,,,,,,,,,,,,,,,,,,,,,,,,,,
36,show me the airlines with first class flights,,,,,,,,,,,,,,,,,first class,,,,,,,,,,,,,,,,,,,,,,,,,,,,,,,,,,,,,,,,,,,,,,,,,,,,,,,,,,,,,,
37,what are the flights from st. louis to burbank sunday evening,st. louis,,burbank,,,sunday,evening,,,,,,,,,,,,,,,,,,,,,,,,,,,,,,,,,,,,,,,,,,,,,,,,,,,,,,,,,,,,,,,,,,,,,,,,
38,i 'd like to arrange a flight from pittsburgh to atlanta,pittsburgh,,atlanta,,,,,,,,,,,,,,,,,,,,,,,,,,,,,,,,,,,,,,,,,,,,,,,,,,,,,,,,,,,,,,,,,,,,,,,,,,,,
39,show flights from baltimore to san francisco between 6 pm and 8 pm on friday,baltimore,,san francisco,,,friday,,,,,,,,,,,,,,,6 pm,8 pm,,,,,,,,,,,,,,,,,,,,,,,,,,,,,,,,,,,,,,,,,,,,,,,,,,,,,,,,,
40,how far is it from orlando airport to orlando,,,orlando,,,,,,,,,,,,,,,,,,,,orlando airport,,,,,,,,,,,,,,,,,,,,,,,,,,,,,,,,,,,,,,,,,,,,,,,,,,,,,,,,
41,i would like a list of round trip flights between indianapolis and orlando florida for the twenty seventh and the twenty eighth of december,indianapolis,,orlando,,,,,,,round trip,,,,,,,,,,,,,,florida,twenty eighth,december,,,,,,,,,,,,,,,,,,,,,,,,,,,,,,,,,,,,,,,,,,,,,,,,,,,,,
42,which airline has the most arrivals in atlanta,,,atlanta,,,,,,,,,,,,,,,,,,,,,,,,most,,,,,,,,,,,,,,,,,,,,,,,,,,,,,,,,,,,,,,,,,,,,,,,,,,,,
43,what airlines fly from new york to milwaukee to los angeles,new york,,los angeles,,,,,,,,,,,milwaukee,,,,,,,,,,,,,,,,,,,,,,,,,,,,,,,,,,,,,,,,,,,,,,,,,,,,,,,,,,,,,,,,,
44,pittsburgh to denver,pittsburgh,,denver,,,,,,,,,,,,,,,,,,,,,,,,,,,,,,,,,,,,,,,,,,,,,,,,,,,,,,,,,,,,,,,,,,,,,,,,,,,,
45,which airlines serve atlanta,,,,,,,,,,,,,atlanta,,,,,,,,,,,,,,,,,,,,,,,,,,,,,,,,,,,,,,,,,,,,,,,,,,,,,,,,,,,,,,,,,,
46,show me information on ground transportation for dallas,,,,,,,,,,,,,dallas,,,,,,,,,,,,,,,,,,,,,,,,,,,,,,,,,,,,,,,,,,,,,,,,,,,,,,,,,,,,,,,,,,
47,what is fare code h,,,,,,,,,,,,,,,,,,,,,,,,,,,,h,,,,,,,,,,,,,,,,,,,,,,,,,,,,,,,,,,,,,,,,,,,,,,,,,,,
48,show me all flights from boston to dallas fort worth both direct and connecting that arrive before noon,boston,,dallas fort worth,noon,,,,,,,,,,,,,,,,before,,,,,,,,,,,,,,,,,,,,,,,,,,,,,,,,,,,,,,,,,,,,,,,,,,,,,,,,,,,
49,i need a flight from charlotte to newark leaving today evening,charlotte,,newark,,,,evening,,,,,today,,,,,,,,,,,,,,,,,,,,,,,,,,,,,,,,,,,,,,,,,,,,,,,,,,,,,,,,,,,,,,,,,,,
50,what are the times that you have planes leaving from san francisco going to pittsburgh on july seventh,san francisco,,pittsburgh,,,,,times,,,,,,,,,,,,,,,,,seventh,july,,,,,,,,,,,,,,,,,,,,,,,,,,,,,,,,,,,,,,,,,,,,,,,,,,,,,
51,flights from newark to cleveland,newark,,cleveland,,,,,,,,,,,,,,,,,,,,,,,,,,,,,,,,,,,,,,,,,,,,,,,,,,,,,,,,,,,,,,,,,,,,,,,,,,,,
52,what flights go from boston to pittsburgh after 6 o'clock next tuesday,boston,6 o'clock,pittsburgh,,,tuesday,,,,,,,,,,after,,next,,,,,,,,,,,,,,,,,,,,,,,,,,,,,,,,,,,,,,,,,,,,,,,,,,,,,,,,,,,,,
53,how much does the limousine service cost within pittsburgh,,,,,,,,,,,,,pittsburgh,,,,,,,,,,,,,,,,limousine,,,,,,,,,,,,,,,,,,,,,,,,,,,,,,,,,,,,,,,,,,,,,,,,,,
54,does us air have any flights out of atlanta to denver,atlanta,,denver,,,,,,,,,,,,,,,,us air,,,,,,,,,,,,,,,,,,,,,,,,,,,,,,,,,,,,,,,,,,,,,,,,,,,,,,,,,,,,
55,what is booking class c,,,,,,,,,,,,,,,,,,,,,,,,,,,,c,,,,,,,,,,,,,,,,,,,,,,,,,,,,,,,,,,,,,,,,,,,,,,,,,,,
56,i 'd like to know the shortest trip between boston and san francisco,boston,,san francisco,,,,,,,,,,,,,,,,,,,,,,,,,,,shortest,,,,,,,,,,,,,,,,,,,,,,,,,,,,,,,,,,,,,,,,,,,,,,,,,
57,i would like to see information for flights from san francisco leaving after 12 pm to pittsburgh on monday,san francisco,12 pm,pittsburgh,,,monday,,,,,,,,,,after,,,,,,,,,,,,,,,,,,,,,,,,,,,,,,,,,,,,,,,,,,,,,,,,,,,,,,,,,,,,,,,
58,what is the least expensive flight from denver to atlanta,denver,,atlanta,,,,,,least expensive,,,,,,,,,,,,,,,,,,,,,,,,,,,,,,,,,,,,,,,,,,,,,,,,,,,,,,,,,,,,,,,,,,,,,,
59,i need to know information for flights leaving dallas on tuesday evening and returning to atlanta,dallas,,atlanta,,,tuesday,evening,,,,,,,,,,,,,,,,,,,,,,,,,,,,,,,,,,,,,,,,,,,,,,,,,,,,,,,,,,,,,,,,,,,,,,,,
60,what flight goes from denver to baltimore first class on united airlines arriving on may seventh,denver,,baltimore,,,,,,,,,,,,,,first class,,united airlines,,,,,,,,,,,,may,seventh,,,,,,,,,,,,,,,,,,,,,,,,,,,,,,,,,,,,,,,,,,,,,,,
61,could you please tell me the airlines that fly from toronto to san diego,toronto,,san diego,,,,,,,,,,,,,,,,,,,,,,,,,,,,,,,,,,,,,,,,,,,,,,,,,,,,,,,,,,,,,,,,,,,,,,,,,,,,
62,what flights do you have from burbank to tacoma washington,burbank,,tacoma,,,,,,,,,,,,,,,,,,,,,washington,,,,,,,,,,,,,,,,,,,,,,,,,,,,,,,,,,,,,,,,,,,,,,,,,,,,,,,
63,what is the ground transportation from philadelphia airport to the city proper,,,,,,,,,,,,,,,,,,,,,,,philadelphia airport,,,,,,,,,,,,,,,,,,,,,,,,,,,,,,,,,,,,,,,,,,,,,,,,,,,,,,,,
64,which airlines have first class flights today,,,,,,,,,,,,today,,,,,first class,,,,,,,,,,,,,,,,,,,,,,,,,,,,,,,,,,,,,,,,,,,,,,,,,,,,,,,,,,,,,,
65,find the latest flight from san francisco to atlanta that serves a meal,san francisco,,atlanta,,,,,,,,,,,,,,,,,,,,,,,,,,,latest,,,meal,,,,,,,,,,,,,,,,,,,,,,,,,,,,,,,,,,,,,,,,,,,,,,
66,i would like to make a reservation for a flight to denver from philadelphia on this coming sunday,philadelphia,,denver,,,sunday,,,,,,,,,,,,this,,,,,,,,,,,,,,,,,,,,,,,,,,,,,,,,,,,,,,,,,,,,,,,,,,,,,,,,,,,,,
67,give me a list of airports in baltimore,,,,,,,,,,,,,baltimore,,,,,,,,,,,,,,,,,,,,,,,,,,,,,,,,,,,,,,,,,,,,,,,,,,,,,,,,,,,,,,,,,,
68,show me flights from boston to denver on wednesday,boston,,denver,,,wednesday,,,,,,,,,,,,,,,,,,,,,,,,,,,,,,,,,,,,,,,,,,,,,,,,,,,,,,,,,,,,,,,,,,,,,,,,,
69,show me the flights from boston to baltimore,boston,,baltimore,,,,,,,,,,,,,,,,,,,,,,,,,,,,,,,,,,,,,,,,,,,,,,,,,,,,,,,,,,,,,,,,,,,,,,,,,,,,
70,what does fare code q mean,,,,,,,,,,,,,,,,,,,,,,,,,,,,q,,,,,,,,,,,,,,,,,,,,,,,,,,,,,,,,,,,,,,,,,,,,,,,,,,,
71,please give me the flights from san francisco to washington dc,san francisco,,washington,,,,,,,,,,,,,,,,,,,,,,,,,,,,,,,dc,,,,,,,,,,,,,,,,,,,,,,,,,,,,,,,,,,,,,,,,,,,,,
72,i need information from denver to pittsburgh,denver,,pittsburgh,,,,,,,,,,,,,,,,,,,,,,,,,,,,,,,,,,,,,,,,,,,,,,,,,,,,,,,,,,,,,,,,,,,,,,,,,,,,
73,from seattle to salt lake city,seattle,,salt lake city,,,,,,,,,,,,,,,,,,,,,,,,,,,,,,,,,,,,,,,,,,,,,,,,,,,,,,,,,,,,,,,,,,,,,,,,,,,,
74,what is the earliest flight from boston to bwi that serves a snack,boston,,,,,,,,,,,,,,bwi,,,,,,,,,,,,,,,earliest,,,,,snack,,,,,,,,,,,,,,,,,,,,,,,,,,,,,,,,,,,,,,,,,,,,
75,what types of aircraft does delta fly,,,,,,,,,,,,,,,,,,,delta,,,,,,,,,,,,,,,,,,,,,,,,,,,,,,,,,,,,,,,,,,,,,,,,,,,,,,,,,,,,
76,what is the cost of a round trip flight from pittsburgh to atlanta beginning on april twenty fifth and returning on may sixth,pittsburgh,,atlanta,,,,,,,round trip,,,,,,,,,,,,,,,twenty fifth,april,,,,,,,,,,may,sixth,,,,,,,,,,,,,,,,,,,,,,,,,,,,,,,,,,,,,,,,,,
77,give me the flights leaving denver august ninth coming back to boston,denver,,boston,,,,,,,,,,,,,,,,,,,,,,ninth,august,,,,,,,,,,,,,,,,,,,,,,,,,,,,,,,,,,,,,,,,,,,,,,,,,,,,,
78,list all the flights that fly into general mitchell international,,,,,,,,,,,,,,,,,,,,,,,general mitchell international,,,,,,,,,,,,,,,,,,,,,,,,,,,,,,,,,,,,,,,,,,,,,,,,,,,,,,,,
79,what flights fly from denver to san francisco on monday tuesday wednesday thursday and friday,denver,,san francisco,,,friday,,,,,,,,,,,,,,,,,,,,,,,,,,,,,,,,,,,,,,,,,,,,,,,,,,,,,,,,,,,,,,,,,,,,,,,,,
80,list all flights from indianapolis to seattle,indianapolis,,seattle,,,,,,,,,,,,,,,,,,,,,,,,,,,,,,,,,,,,,,,,,,,,,,,,,,,,,,,,,,,,,,,,,,,,,,,,,,,,
81,in flight meal oakland to philadelphia saturday,oakland,,philadelphia,,,saturday,,,,,,,,,,,,,,,,,,,,,,,,,,,meal,,,,,,,,,,,,,,,,,,,,,,,,,,,,,,,,,,,,,,,,,,,,,,
82,show me the flights on twa from atlanta in the morning,atlanta,,,,,,morning,,,,,,,,,,,,,,,,,,,,,,,,,,,,,,,twa,,,,,,,,,,,,,,,,,,,,,,,,,,,,,,,,,,,,,,,,,
83,i want to find the first flight from baltimore to boston that serves a meal,baltimore,,boston,,,,,,,,,,,,,,,,,,,,,,,,,,,first,,,meal,,,,,,,,,,,,,,,,,,,,,,,,,,,,,,,,,,,,,,,,,,,,,,
84,of all airlines which airline has the most arrivals in atlanta,,,atlanta,,,,,,,,,,,,,,,,,,,,,,,,most,,,,,,,,,,,,,,,,,,,,,,,,,,,,,,,,,,,,,,,,,,,,,,,,,,,,
85,display all flights from baltimore to boston on july twenty ninth,baltimore,,boston,,,,,,,,,,,,,,,,,,,,,,twenty ninth,july,,,,,,,,,,,,,,,,,,,,,,,,,,,,,,,,,,,,,,,,,,,,,,,,,,,,,
86,i want to travel from atlanta to baltimore early in the morning first flight,atlanta,,baltimore,,,,morning,,,,,,,,,,,,,,,,,,,,,,,first,,,,,,,,,early,,,,,,,,,,,,,,,,,,,,,,,,,,,,,,,,,,,,,,,,
87,i now need a flight from san jose to houston leaving on sunday the fourth,san jose,,houston,,,sunday,,,,,,,,,,,,,,,,,,,fourth,,,,,,,,,,,,,,,,,,,,,,,,,,,,,,,,,,,,,,,,,,,,,,,,,,,,,,
88,what are the flights available after 6 pm between san francisco and boston,san francisco,6 pm,boston,,,,,,,,,,,,,after,,,,,,,,,,,,,,,,,,,,,,,,,,,,,,,,,,,,,,,,,,,,,,,,,,,,,,,,,,,,,,,
89,what flights depart baltimore on friday and arrive in san francisco by 8 pm,baltimore,,san francisco,8 pm,,friday,,,,,,,,,,,,,,by,,,,,,,,,,,,,,,,,,,,,,,,,,,,,,,,,,,,,,,,,,,,,,,,,,,,,,,,,,,
90,show me flights from boston to san francisco,boston,,san francisco,,,,,,,,,,,,,,,,,,,,,,,,,,,,,,,,,,,,,,,,,,,,,,,,,,,,,,,,,,,,,,,,,,,,,,,,,,,,
91,list the delta airlines flights from boston to philadelphia,boston,,philadelphia,,,,,,,,,,,,,,,,delta airlines,,,,,,,,,,,,,,,,,,,,,,,,,,,,,,,,,,,,,,,,,,,,,,,,,,,,,,,,,,,,
92,show me the fares from dallas to san francisco,dallas,,san francisco,,,,,,,,,,,,,,,,,,,,,,,,,,,,,,,,,,,,,,,,,,,,,,,,,,,,,,,,,,,,,,,,,,,,,,,,,,,,
93,what nonstop flights between boston and washington arrive after 4 o'clock pm,boston,,washington,4 o'clock pm,,,,,,,,,,,,,,,,after,,,,,,,,,,,,,,,,,,,,nonstop,,,,,,,,,,,,,,,,,,,,,,,,,,,,,,,,,,,,,,,
94,what is the distance from los angeles international airport to los angeles,,,los angeles,,,,,,,,,,,,,,,,,,,,los angeles international airport,,,,,,,,,,,,,,,,,,,,,,,,,,,,,,,,,,,,,,,,,,,,,,,,,,,,,,,,
95,ground transportation in san jose,,,,,,,,,,,,,san jose,,,,,,,,,,,,,,,,,,,,,,,,,,,,,,,,,,,,,,,,,,,,,,,,,,,,,,,,,,,,,,,,,,
96,please tell me how many nonstop flights there are from boston to atlanta,boston,,atlanta,,,,,,,,,,,,,,,,,,,,,,,,,,,,,,,,,,,,,nonstop,,,,,,,,,,,,,,,,,,,,,,,,,,,,,,,,,,,,,,,
97,on the earliest flight from san francisco to atlanta on delta is a meal being served,san francisco,,atlanta,,,,,,,,,,,,,,,,delta,,,,,,,,,,,earliest,,,meal,,,,,,,,,,,,,,,,,,,,,,,,,,,,,,,,,,,,,,,,,,,,,,
98,where does canadian airlines international fly,,,,,,,,,,,,,,,,,,,canadian airlines international,,,,,,,,,,,,,,,,,,,,,,,,,,,,,,,,,,,,,,,,,,,,,,,,,,,,,,,,,,,,
99,what flights from denver to pittsburgh arrive before 8 in the morning,denver,,pittsburgh,8,morning,,,,,,,,,,,,,,,before,,,,,,,,,,,,,,,,,,,,,,,,,,,,,,,,,,,,,,,,,,,,,,,,,,,,,,,,,,,
100,find me the earliest flight from boston to atlanta,boston,,atlanta,,,,,,,,,,,,,,,,,,,,,,,,,,,earliest,,,,,,,,,,,,,,,,,,,,,,,,,,,,,,,,,,,,,,,,,,,,,,,,,
101,list nonstop flights from houston to dallas which arrive before midnight,houston,,dallas,,midnight,,,,,,,,,,,,,,,before,,,,,,,,,,,,,,,,,,,,nonstop,,,,,,,,,,,,,,,,,,,,,,,,,,,,,,,,,,,,,,,
102,show me the flights from boston to san francisco that stop in atlanta,boston,,san francisco,,,,,,,,,,,atlanta,,,,,,,,,,,,,,,,,,,,,,,,,,,,,,,,,,,,,,,,,,,,,,,,,,,,,,,,,,,,,,,,,
103,show me flights to san francisco from philadelphia stopping in dallas,philadelphia,,san francisco,,,,,,,,,,,dallas,,,,,,,,,,,,,,,,,,,,,,,,,,,,,,,,,,,,,,,,,,,,,,,,,,,,,,,,,,,,,,,,,
104,what city is the airport mco in,,,,,,,,,,,,,,,,,,,,,,,,,,,,,,,,,,,,,,,,,mco,,,,,,,,,,,,,,,,,,,,,,,,,,,,,,,,,,,,,,
105,how much does it cost to rent a car in tacoma,,,,,,,,,,,,,tacoma,,,,,,,,,,,,,,,,car,,,,,,,,,,,,,,,,,,,,,,,,,,,,,,,,,,,,,,,,,,,,,,,,,,
106,show me flights from baltimore to dallas,baltimore,,dallas,,,,,,,,,,,,,,,,,,,,,,,,,,,,,,,,,,,,,,,,,,,,,,,,,,,,,,,,,,,,,,,,,,,,,,,,,,,,
107,show me a list of ground transportation at denver,,,,,,,,,,,,,denver,,,,,,,,,,,,,,,,,,,,,,,,,,,,,,,,,,,,,,,,,,,,,,,,,,,,,,,,,,,,,,,,,,
108,i 'd like a flight from columbus to phoenix stopping in cincinnati and serving dinner what 's available,columbus,,phoenix,,,,,,,,,,,cincinnati,,,,,,,,,,,,,,,,,,,,,dinner,,,,,,,,,,,,,,,,,,,,,,,,,,,,,,,,,,,,,,,,,,,,
109,also show me flights from san francisco to pittsburgh on tuesday,san francisco,,pittsburgh,,,tuesday,,,,,,,,,,,,,,,,,,,,,,,,,,,,,,,,,,,,,,,,,,,,,,,,,,,,,,,,,,,,,,,,,,,,,,,,,
110,show flights from dallas to oakland,dallas,,oakland,,,,,,,,,,,,,,,,,,,,,,,,,,,,,,,,,,,,,,,,,,,,,,,,,,,,,,,,,,,,,,,,,,,,,,,,,,,,
111,give me the cheapest flight from charlotte to long beach,charlotte,,long beach,,,,,,cheapest,,,,,,,,,,,,,,,,,,,,,,,,,,,,,,,,,,,,,,,,,,,,,,,,,,,,,,,,,,,,,,,,,,,,,,
112,show me all flights from san francisco to pittsburgh,san francisco,,pittsburgh,,,,,,,,,,,,,,,,,,,,,,,,,,,,,,,,,,,,,,,,,,,,,,,,,,,,,,,,,,,,,,,,,,,,,,,,,,,,
113,find me a flight on united from boston to san francisco with a stopover in denver,boston,,san francisco,,,,,,,,,,,denver,,,,,united,,,,,,,,,,,,,,,,,,,,,,,,,,,,,,,,,,,,,,,,,,,,,,,,,,,,,,,,,,,,
114,show me the last flight from love field,,,,,,,,,,,,,,,,,,,,,,,love field,,,,,,,last,,,,,,,,,,,,,,,,,,,,,,,,,,,,,,,,,,,,,,,,,,,,,,,,,
115,what flights go from newark to boston after 5 pm,newark,5 pm,boston,,,,,,,,,,,,,after,,,,,,,,,,,,,,,,,,,,,,,,,,,,,,,,,,,,,,,,,,,,,,,,,,,,,,,,,,,,,,,
116,what are all the flights from boston to dallas,boston,,dallas,,,,,,,,,,,,,,,,,,,,,,,,,,,,,,,,,,,,,,,,,,,,,,,,,,,,,,,,,,,,,,,,,,,,,,,,,,,,
117,what is the earliest flight departing san francisco and arriving in boston on november ninth,san francisco,,boston,,,,,,,,,,,,,,,,,,,,,,,,,,,earliest,november,ninth,,,,,,,,,,,,,,,,,,,,,,,,,,,,,,,,,,,,,,,,,,,,,,,
118,what is the earliest flight flying from pittsburgh to atlanta on july fifth,pittsburgh,,atlanta,,,,,,,,,,,,,,,,,,,,,,fifth,july,,,,earliest,,,,,,,,,,,,,,,,,,,,,,,,,,,,,,,,,,,,,,,,,,,,,,,,,
119,please list available flights for next saturday from philadelphia to dallas,philadelphia,,dallas,,,saturday,,,,,,,,,,,,next,,,,,,,,,,,,,,,,,,,,,,,,,,,,,,,,,,,,,,,,,,,,,,,,,,,,,,,,,,,,,
120,what flights leave pittsburgh and arrive in los angeles after 5 pm on thursday,pittsburgh,,los angeles,5 pm,,,,,,,,,,,,,,,,after,,,,,,,,,,,,,,,,,,,,,,thursday,,,,,,,,,,,,,,,,,,,,,,,,,,,,,,,,,,,,,
121,what is the transportation time from the airport to boston,,,boston,,,,,,,,,,,,,,,,,,,,,,,,,,,,,,,,,,,,,,,,time,,,,,,,,,,,,,,,,,,,,,,,,,,,,,,,,,,,,
122,which airline has the smallest plane leaving pittsburgh and arriving in baltimore on july fourth,pittsburgh,,baltimore,,,,,,,,,,,,,,,,,,,,,,,,smallest,,,,july,fourth,,,,,,,,,,,,,,,,,,,,,,,,,,,,,,,,,,,,,,,,,,,,,,,
123,what are the nonstop flights on america west or southwest air from kansas city to burbank on saturday may twenty two,kansas city,,burbank,,,,,,,,,,,,,,,,southwest,,,,,,,,,,,,may,twenty two,,,,,,,,nonstop,,saturday,,or,,,,,,,,,,,,,,,,,,,,,,,,,,,,,,,,,,,
124,what are the classes of service for american airlines,,,,,,,,,,,,,,,,,,,american airlines,,,,,,,,,,,,,,,,,,,,,,,,,,,,,,,,,,,,,,,,,,,,,,,,,,,,,,,,,,,,
125,i would like to find out what flights there are on friday june eleventh from st. petersburg to milwaukee and then from milwaukee to tacoma thank you,milwaukee,,tacoma,,,friday,,,,,,,,,,,,,,,,,,,eleventh,june,,,,,,,,,,,,,,,,,,,,,,,,,,,,,,,,,,,,,,,,,,,,,,,,,,,,,
126,all flights from boston to washington dc on november tenth,boston,,washington,,,,,,,,,,,,,,,,,,,,,,tenth,november,,,,,,,,dc,,,,,,,,,,,,,,,,,,,,,,,,,,,,,,,,,,,,,,,,,,,,,
127,what are the flights from denver to san francisco,denver,,san francisco,,,,,,,,,,,,,,,,,,,,,,,,,,,,,,,,,,,,,,,,,,,,,,,,,,,,,,,,,,,,,,,,,,,,,,,,,,,,
128,on the 8 am flight from san francisco to atlanta what type of aircraft is used,san francisco,8 am,atlanta,,,,,,,,,,,,,,,,,,,,,,,,,,,,,,,,,,,,,,,,,,,,,,,,,,,,,,,,,,,,,,,,,,,,,,,,,,,,
129,which flight is a one way fare at 329 dollars from denver to pittsburgh,denver,,pittsburgh,,,,,,,one way,329 dollars,,,,,,,,,,,,,,,,,,,,,,,,,,,,,,,,,,,,,,,,,,,,,,,,,,,,,,,,,,,,,,,,,,,,
130,what flights leave baltimore for boston after 6 o'clock on friday,baltimore,6 o'clock,boston,,,friday,,,,,,,,,,after,,,,,,,,,,,,,,,,,,,,,,,,,,,,,,,,,,,,,,,,,,,,,,,,,,,,,,,,,,,,,,,
131,okay i need to get a flight from houston to seattle,houston,,seattle,,,,,,,,,,,,,,,,,,,,,,,,,,,,,,,,,,,,,,,,,,,,,,,,,,,,,,,,,,,,,,,,,,,,,,,,,,,,
132,please list flights between denver and boston,denver,,boston,,,,,,,,,,,,,,,,,,,,,,,,,,,,,,,,,,,,,,,,,,,,,,,,,,,,,,,,,,,,,,,,,,,,,,,,,,,,
133,find me the flights that are nonstop between boston and dallas that leave between 12 and 2 in the afternoon,boston,,dallas,,,,afternoon,,,,,,,,,,,,,,12,2,,,,,,,,,,,,,,,,,,nonstop,,,,,,,,,,,,,,,,,,,,,,,,,,,,,,,,,,,,,,,
134,i would like some information on flights leaving boston to atlanta,boston,,atlanta,,,,,,,,,,,,,,,,,,,,,,,,,,,,,,,,,,,,,,,,,,,,,,,,,,,,,,,,,,,,,,,,,,,,,,,,,,,,
135,show me the latest nonstop flight from denver to washington dc,denver,,washington,,,,,,,,,,,,,,,,,,,,,,,,,,,latest,,,,dc,,,,,,nonstop,,,,,,,,,,,,,,,,,,,,,,,,,,,,,,,,,,,,,,,
136,what are the flights from dallas to baltimore,dallas,,baltimore,,,,,,,,,,,,,,,,,,,,,,,,,,,,,,,,,,,,,,,,,,,,,,,,,,,,,,,,,,,,,,,,,,,,,,,,,,,,
137,i would like a nonstop flight from new york to las vegas on march second,new york,,las vegas,,,,,,,,,,,,,,,,,,,,,,,,,,,,march,second,,,,,,,,nonstop,,,,,,,,,,,,,,,,,,,,,,,,,,,,,,,,,,,,,,,
138,no i want to go from denver to oakland,denver,,oakland,,,,,,,,,,,,,,,,,,,,,,,,,,,,,,,,,,,,,,,,,,,,,,,,,,,,,,,,,,,,,,,,,,,,,,,,,,,,
139,show me all the night fares between philadelphia and san francisco,philadelphia,,san francisco,,,,night,,,,,,,,,,,,,,,,,,,,,,,,,,,,,,,,,,,,,,,,,,,,,,,,,,,,,,,,,,,,,,,,,,,,,,,,
140,what kinds of ground transportation is available in dallas fort worth,,,,,,,,,,,,,dallas fort worth,,,,,,,,,,,,,,,,,,,,,,,,,,,,,,,,,,,,,,,,,,,,,,,,,,,,,,,,,,,,,,,,,,
141,can you show me economy class one way fares for flights from oakland to dallas on december sixteenth,oakland,,dallas,,,,,,,one way,,,,,,,,,,,,,,,sixteenth,december,,,,,,,,,,,,,,,,,,,economy class,,,,,,,,,,,,,,,,,,,,,,,,,,,,,,,,,,
142,what is fare code qw,,,,,,,,,,,,,,,,,,,,,,,,,,,,qw,,,,,,,,,,,,,,,,,,,,,,,,,,,,,,,,,,,,,,,,,,,,,,,,,,,
143,i 'd like a flight on july ninth from orlando to kansas city in the afternoon,orlando,,kansas city,,,,afternoon,,,,,,,,,,,,,,,,,,ninth,july,,,,,,,,,,,,,,,,,,,,,,,,,,,,,,,,,,,,,,,,,,,,,,,,,,,,,
144,what are the coach fares from charlotte to la wednesday night,charlotte,,la,,,wednesday,night,,,,,,,,,,coach,,,,,,,,,,,,,,,,,,,,,,,,,,,,,,,,,,,,,,,,,,,,,,,,,,,,,,,,,,,,,,
