2361,how about arrivals for american in atlanta,,,atlanta,,,,,,,,,,,,,,,,american,,,,,,,,,,,,,,,,,,,,,,,,,,,,,,,,,,,,,,,,,,,,,,,,,,,,,,,,,,,,
2362,what airlines fly between atlanta and san francisco,atlanta,,san francisco,,,,,,,,,,,,,,,,,,,,,,,,,,,,,,,,,,,,,,,,,,,,,,,,,,,,,,,,,,,,,,,,,,,,,,,,,,,,
2363,show me the flights arriving in baltimore on june fifteenth leaving either from denver or dallas,dallas,,baltimore,,,,,,,,,,,,,,,,,,,,,,,,,,,,june,fifteenth,,,,,,,,,,,,or,,,,,,,,,,,,,,,,,,,,,,,,,,,,,,,,,,,
2364,i want to fly from boston to dallas,boston,,dallas,,,,,,,,,,,,,,,,,,,,,,,,,,,,,,,,,,,,,,,,,,,,,,,,,,,,,,,,,,,,,,,,,,,,,,,,,,,,
2365,ground transportation philadelphia,,,,,,,,,,,,,philadelphia,,,,,,,,,,,,,,,,,,,,,,,,,,,,,,,,,,,,,,,,,,,,,,,,,,,,,,,,,,,,,,,,,,
2366,show me flights from denver to philadelphia arriving after 2100,denver,,philadelphia,2100,,,,,,,,,,,,,,,,after,,,,,,,,,,,,,,,,,,,,,,,,,,,,,,,,,,,,,,,,,,,,,,,,,,,,,,,,,,,
2367,i need a flight from st. petersburg to miami for thursday,st. petersburg,,miami,,,thursday,,,,,,,,,,,,,,,,,,,,,,,,,,,,,,,,,,,,,,,,,,,,,,,,,,,,,,,,,,,,,,,,,,,,,,,,,
2368,then list the flights from atlanta to philadelphia early wednesday morning nonstop,atlanta,,philadelphia,,,wednesday,morning,,,,,,,,,,,,,,,,,,,,,,,,,,,,,,,,early,nonstop,,,,,,,,,,,,,,,,,,,,,,,,,,,,,,,,,,,,,,,
2369,can you list costs of denver rental cars,,,,,,,,,,,,,denver,,,,,,,,,,,,,,,,rental cars,,,,,,,,,,,,,,,,,,,,,,,,,,,,,,,,,,,,,,,,,,,,,,,,,,
2370,list the flights on wednesday from denver to washington arriving in washington between 1115 am and 1245 pm,denver,,washington,,,wednesday,,,,,,,,,,,,,,,,,,,,,,,,,,,,,,,,,,,,,,,,,,,,,1115 am,1245 pm,,,,,,,,,,,,,,,,,,,,,,,,,,,
2371,what airlines fly between san francisco and denver,san francisco,,denver,,,,,,,,,,,,,,,,,,,,,,,,,,,,,,,,,,,,,,,,,,,,,,,,,,,,,,,,,,,,,,,,,,,,,,,,,,,,
2372,can you list all nonstop flights between st. petersburg and charlotte that leave in the afternoon and arrive soon after 5 pm,st. petersburg,,charlotte,5 pm,afternoon,,,,,,,,,,,,,,,after,,,,,,,,,,,,,,,,,,,,nonstop,,,,,,,,,,,,,,,,,,,,,,,,,,,,,,,,,,,,,,,
2373,now i 'd like to see flights from detroit to st. petersburg on the next tuesday,detroit,,st. petersburg,,,tuesday,,,,,,,,,,,,next,,,,,,,,,,,,,,,,,,,,,,,,,,,,,,,,,,,,,,,,,,,,,,,,,,,,,,,,,,,,,
2374,flights from cincinnati to dallas departing after 718 am,cincinnati,718 am,dallas,,,,,,,,,,,,,after,,,,,,,,,,,,,,,,,,,,,,,,,,,,,,,,,,,,,,,,,,,,,,,,,,,,,,,,,,,,,,,
2375,how about flights leaving san francisco and arriving in boston for any day,san francisco,,boston,,,,,,,,,,,,,,,,,,,,,,,,,,,,,,,,,,,,,,,,,,,,,,,,,,,,,,,,,,,,,,,,,,,,,,,,,,,,
2376,i would like information on twa flights from washington to philadelphia,washington,,philadelphia,,,,,,,,,,,,,,,,,,,,,,,,,,,,,,,,,,,twa,,,,,,,,,,,,,,,,,,,,,,,,,,,,,,,,,,,,,,,,,
2377,okay can you tell me the earliest flight which leaves from philadelphia to dallas,philadelphia,,dallas,,,,,,,,,,,,,,,,,,,,,,,,,,,earliest,,,,,,,,,,,,,,,,,,,,,,,,,,,,,,,,,,,,,,,,,,,,,,,,,
2378,what is restriction ap 55,,,,,,,,,,,,,,,,,,,,,,,,,,,,,,,,,,,,,,,,,,,,,,,,,,,,,,,,,,,,,ap 55,,,,,,,,,,,,,,,,,,
2379,what ground transportation is there in oakland,,,,,,,,,,,,,oakland,,,,,,,,,,,,,,,,,,,,,,,,,,,,,,,,,,,,,,,,,,,,,,,,,,,,,,,,,,,,,,,,,,
2380,newark to cleveland,newark,,cleveland,,,,,,,,,,,,,,,,,,,,,,,,,,,,,,,,,,,,,,,,,,,,,,,,,,,,,,,,,,,,,,,,,,,,,,,,,,,,
2381,what 's the cheapest flight from denver to pittsburgh for both one way and round trip flights,denver,,pittsburgh,,,,,,cheapest,round trip,,,,,,,,,,,,,,,,,,,,,,,,,,,,,,,,,,,,,,,,,,,,,,,,,,,,,,,,,,,,,,,,,,,,,
2382,can you show me what flights are available on december sixteen going from oakland to dallas,oakland,,dallas,,,,,,,,,,,,,,,,,,,,,,sixteen,december,,,,,,,,,,,,,,,,,,,,,,,,,,,,,,,,,,,,,,,,,,,,,,,,,,,,,
2383,how can i go from minneapolis to long beach late tomorrow,minneapolis,,long beach,,,,,,,,,tomorrow,,,,,,,,,,,,,,,,,,,,,,,,,,,late,,,,,,,,,,,,,,,,,,,,,,,,,,,,,,,,,,,,,,,,
2384,please show me flights from pittsburgh to boston on saturday morning after 8 am,pittsburgh,8 am,boston,,,saturday,morning,,,,,,,,,after,,,,,,,,,,,,,,,,,,,,,,,,,,,,,,,,,,,,,,,,,,,,,,,,,,,,,,,,,,,,,,,
2385,show me all prices of economy from baltimore to dallas,baltimore,,dallas,,,,,,,,,,,,,,,,,,,,,,,,,,,,,,,,,,,,,,,,,,economy,,,,,,,,,,,,,,,,,,,,,,,,,,,,,,,,,,
2386,what flights are available on dl from dallas to atlanta on monday morning,dallas,,atlanta,,,monday,morning,,,,,,,,,,,,,,,,,,,,,,,,,,,,,,,dl,,,,,,,,,,,,,,,,,,,,,,,,,,,,,,,,,,,,,,,,,
2387,i would like to fly from boston to baltimore,boston,,baltimore,,,,,,,,,,,,,,,,,,,,,,,,,,,,,,,,,,,,,,,,,,,,,,,,,,,,,,,,,,,,,,,,,,,,,,,,,,,,
2388,what are the evening flights from atlanta to baltimore,atlanta,,baltimore,,,,evening,,,,,,,,,,,,,,,,,,,,,,,,,,,,,,,,,,,,,,,,,,,,,,,,,,,,,,,,,,,,,,,,,,,,,,,,
2389,can i get a rental car in dallas,,,,,,,,,,,,,dallas,,,,,,,,,,,,,,,,rental car,,,,,,,,,,,,,,,,,,,,,,,,,,,,,,,,,,,,,,,,,,,,,,,,,,
2390,what flights stop in atlanta before noon,,noon,,,,,,,,,,,,atlanta,,before,,,,,,,,,,,,,,,,,,,,,,,,,,,,,,,,,,,,,,,,,,,,,,,,,,,,,,,,,,,,,,,
2391,what are the flights from dallas to philadelphia,dallas,,philadelphia,,,,,,,,,,,,,,,,,,,,,,,,,,,,,,,,,,,,,,,,,,,,,,,,,,,,,,,,,,,,,,,,,,,,,,,,,,,,
2392,what 's the earliest flight from atlanta to boston,atlanta,,boston,,,,,,,,,,,,,,,,,,,,,,,,,,,earliest,,,,,,,,,,,,,,,,,,,,,,,,,,,,,,,,,,,,,,,,,,,,,,,,,
2393,what is ewr,,,,,,,,,,,,,,,,,,,,,,,,,,,,,,,,,,,,,,,,,,,,,,,,,,,,,,,,,ewr,,,,,,,,,,,,,,,,,,,,,,
2394,sure i 'd like to determine what aircraft are use on july seventh leaving from boston and arriving in atlanta on july seventh,boston,,atlanta,,,,,,,,,,,,,,,,,,,,,,seventh,july,,,,,july,seventh,,,,,,,,,,,,,,,,,,,,,,,,,,,,,,,,,,,,,,,,,,,,,,,
2395,flights from denver to chicago on sunday on continental,denver,,chicago,,,sunday,,,,,,,,,,,,,continental,,,,,,,,,,,,,,,,,,,,,,,,,,,,,,,,,,,,,,,,,,,,,,,,,,,,,,,,,,,,
2396,i need to fly from nashville to tacoma first thing in the morning what is there,nashville,,tacoma,,,,morning,,,,,,,,,,,,,,,,,,,,,,,first,,,,,,,,,,,,,,,,,,,,,,,,,,,,,,,,,,,,,,,,,,,,,,,,,
2397,i need a flight from philadelphia to denver,philadelphia,,denver,,,,,,,,,,,,,,,,,,,,,,,,,,,,,,,,,,,,,,,,,,,,,,,,,,,,,,,,,,,,,,,,,,,,,,,,,,,,
2398,okay i 'd like a flight on us air from indianapolis to san diego in the afternoon what 's available,indianapolis,,san diego,,,,afternoon,,,,,,,,,,,,us air,,,,,,,,,,,,,,,,,,,,,,,,,,,,,,,,,,,,,,,,,,,,,,,,,,,,,,,,,,,,
2399,what is the fare going from baltimore to boston one way on november seventh,baltimore,,boston,,,,,,,one way,,,,,,,,,,,,,,,seventh,november,,,,,,,,,,,,,,,,,,,,,,,,,,,,,,,,,,,,,,,,,,,,,,,,,,,,,
2400,what are the flights from denver to san francisco on tuesday october fifteenth,denver,,san francisco,,,tuesday,,,,,,,,,,,,,,,,,,,fifteenth,october,,,,,,,,,,,,,,,,,,,,,,,,,,,,,,,,,,,,,,,,,,,,,,,,,,,,,
2401,what ground transportation is there from the airport in atlanta to downtown,atlanta,,,,,,,,,,,,,,,,,,,,,,,,,,,,,,,,,,,,,,,,,,,,,,,,,,,,,,,,,,,,,,,,,,,,,,,,,,,,,,
2402,what is the last flight from dallas to boston,dallas,,boston,,,,,,,,,,,,,,,,,,,,,,,,,,,last,,,,,,,,,,,,,,,,,,,,,,,,,,,,,,,,,,,,,,,,,,,,,,,,,
2403,flights from baltimore denver and pittsburgh to philadelphia where the round trip fare for each is less than 1000 dollars,pittsburgh,,philadelphia,,,,,,less,round trip,1000 dollars,,,,,,,,,,,,,,,,,,,,,,,,,,,,,,,,,,,,,,,,,,,,,,,,,,,,,,,,,,,,,,,,,,,,
2404,is there one stop with the us air boston leaving at 705 to atlanta,,,atlanta,705,,,,,,,,,,,,,,,us air,,,,,,,,,,,,,,,,,,,,,one stop,,,,,,,,,,,,,,,,,,,,,,,,,,,,,,,,,,,,,,,
2405,i 'm interested in flights from denver to pittsburgh,denver,,pittsburgh,,,,,,,,,,,,,,,,,,,,,,,,,,,,,,,,,,,,,,,,,,,,,,,,,,,,,,,,,,,,,,,,,,,,,,,,,,,,
2406,what is the cheapest flight from long beach to memphis,long beach,,memphis,,,,,,cheapest,,,,,,,,,,,,,,,,,,,,,,,,,,,,,,,,,,,,,,,,,,,,,,,,,,,,,,,,,,,,,,,,,,,,,,
2407,what ground transportation is available at the baltimore airport,,,,,,,,,,,,,,,,,,,,,,,,,,,,,,,,,,,,,,,,,,,,,,,,,,,,,,,,,,,,,,baltimore airport,,,,,,,,,,,,,,,,,
2408,i need a flight from philadelphia to denver on sunday,philadelphia,,denver,,,sunday,,,,,,,,,,,,,,,,,,,,,,,,,,,,,,,,,,,,,,,,,,,,,,,,,,,,,,,,,,,,,,,,,,,,,,,,,
2409,i would like a flight as early as possible in the day leaving from boston and to denver,boston,,denver,,,,,,,,,,,,,,,,,,,,,,,,,,,early,,,,,,,,,,,,,,,,,,,,,,,,,,,,,,,,,,,,,,,,,,,,,,,,,
2410,show me the flights from baltimore to seattle,baltimore,,seattle,,,,,,,,,,,,,,,,,,,,,,,,,,,,,,,,,,,,,,,,,,,,,,,,,,,,,,,,,,,,,,,,,,,,,,,,,,,,
2411,list the takeoffs and landings at general mitchell international,,,,,,,,,,,,,,,,,,,,,,,,,,,,,,,,,,,,,,,,,,,,,,,,,,,,,,,,,,,,,,general mitchell international,,,,,,,,,,,,,,,,,
2412,airports in new york,,,,,,,,,,,,,new york,,,,,,,,,,,,,,,,,,,,,,,,,,,,,,,,,,,,,,,,,,,,,,,,,,,,,,,,,,,,,,,,,,
2413,what is the cheapest fare for flights from boston to dallas,boston,,dallas,,,,,,cheapest,,,,,,,,,,,,,,,,,,,,,,,,,,,,,,,,,,,,,,,,,,,,,,,,,,,,,,,,,,,,,,,,,,,,,,
2414,flights between boston and philadelphia that arrive after 2 o'clock and before 5 o'clock on tuesday,boston,,philadelphia,5 o'clock,,,,,,,,,,,,,,,,before,,,,,,,,,,,,,,,,,,,,,,tuesday,,,,,,,,,,,,,,,,,,,,,,,,,,,,,,,,,,,,,
2415,show me the flights from st. petersburg to toronto that arrive early in the morning,st. petersburg,,toronto,,morning,,,,,,,,,,,,,,,,,,,,,,,,,,,,,,,,,,,,,,,,,,early,,,,,,,,,,,,,,,,,,,,,,,,,,,,,,,,
2416,please list the flights from baltimore to san francisco on fridays,baltimore,,san francisco,,,fridays,,,,,,,,,,,,,,,,,,,,,,,,,,,,,,,,,,,,,,,,,,,,,,,,,,,,,,,,,,,,,,,,,,,,,,,,,
2417,flight from nashville back to milwaukee,nashville,,milwaukee,,,,,,,,,,,,,,,,,,,,,,,,,,,,,,,,,,,,,,,,,,,,,,,,,,,,,,,,,,,,,,,,,,,,,,,,,,,,
2418,i 'd like a ticket on a plane from denver to atlanta i would like a coach class or lowest fare ticket,denver,,atlanta,,,,,,lowest,,,,,,,,coach class,,,,,,,,,,,,,,,,,,,,,,,,,,,,,,,,,,,,,,,,,,,,,,,,,,,,,,,,,,,,,,
2419,please list am flights leaving san francisco boston,boston,,,,,,am,,,,,,,,,,,,,,,,,,,,,,,,,,,,,,,,,,,,,,,,,,,,,,,,,,,,,,,,,,,,,,,,,,,,,,,,
2420,boston ground transportation,,,,,,,,,,,,,boston,,,,,,,,,,,,,,,,,,,,,,,,,,,,,,,,,,,,,,,,,,,,,,,,,,,,,,,,,,,,,,,,,,
2421,all right what do you have from oakland to philadelphia on wednesday,oakland,,philadelphia,,,wednesday,,,,,,,,,,,,,,,,,,,,,,,,,,,,,,,,,,,,,,,,,,,,,,,,,,,,,,,,,,,,,,,,,,,,,,,,,
2422,what flights go from chicago to seattle on continental airlines on saturday,chicago,,seattle,,,saturday,,,,,,,,,,,,,continental airlines,,,,,,,,,,,,,,,,,,,,,,,,,,,,,,,,,,,,,,,,,,,,,,,,,,,,,,,,,,,,
2423,how much does it cost to fly on delta from dallas to baltimore,dallas,,baltimore,,,,,,,,,,,,,,,,delta,,,,,,,,,,,,,,,,,,,,,,,,,,,,,,,,,,,,,,,,,,,,,,,,,,,,,,,,,,,,
2424,show me flights from baltimore to philadelphia,baltimore,,philadelphia,,,,,,,,,,,,,,,,,,,,,,,,,,,,,,,,,,,,,,,,,,,,,,,,,,,,,,,,,,,,,,,,,,,,,,,,,,,,
2425,i 'd like a round trip ticket from los angeles to tacoma washington,los angeles,,tacoma,,,,,,,round trip,,,,,,,,,,,,,,washington,,,,,,,,,,,,,,,,,,,,,,,,,,,,,,,,,,,,,,,,,,,,,,,,,,,,,,,
2426,show me flights which leave from boston on july twenty second arriving in pittsburgh,boston,,pittsburgh,,,,,,,,,,,,,,,,,,,,,,twenty second,july,,,,,,,,,,,,,,,,,,,,,,,,,,,,,,,,,,,,,,,,,,,,,,,,,,,,,
2427,i would like a flight from philadelphia to dallas on american airlines,philadelphia,,dallas,,,,,,,,,,,,,,,,american airlines,,,,,,,,,,,,,,,,,,,,,,,,,,,,,,,,,,,,,,,,,,,,,,,,,,,,,,,,,,,,
2428,i want to fly united airlines from boston to denver,boston,,denver,,,,,,,,,,,,,,,,united airlines,,,,,,,,,,,,,,,,,,,,,,,,,,,,,,,,,,,,,,,,,,,,,,,,,,,,,,,,,,,,
2429,are there any airlines that have flights from boston to philadelphia that leave before 630 am,boston,630 am,philadelphia,,,,,,,,,,,,,before,,,,,,,,,,,,,,,,,,,,,,,,,,,,,,,,,,,,,,,,,,,,,,,,,,,,,,,,,,,,,,,
2430,show me flights from pittsburgh to san francisco on monday,pittsburgh,,san francisco,,,monday,,,,,,,,,,,,,,,,,,,,,,,,,,,,,,,,,,,,,,,,,,,,,,,,,,,,,,,,,,,,,,,,,,,,,,,,,
2431,is there ground transportation between airport and downtown in boston,,,boston,,,,,,,,,,,,,,,,,,,,,,,,,,,,,,,,,,,,,,,,,,,,,,,,,,,,,,,,,,,,,,,,,,,,,,,,,,,,
2432,i 'm interested in flying from atlanta to boston i 'd like to fly during breakfast,atlanta,,boston,,,,,,,,,,,,,,,,,,,,,,,,,,,,,,,,breakfast,,,,,,,,,,,,,,,,,,,,,,,,,,,,,,,,,,,,,,,,,,,,
2433,ground transportation washington,,,,,,,,,,,,,washington,,,,,,,,,,,,,,,,,,,,,,,,,,,,,,,,,,,,,,,,,,,,,,,,,,,,,,,,,,,,,,,,,,
2434,i need to catch an evening flight from boston to philadelphia on august first,boston,,philadelphia,,,,evening,,,,,,,,,,,,,,,,,,first,august,,,,,,,,,,,,,,,,,,,,,,,,,,,,,,,,,,,,,,,,,,,,,,,,,,,,,
2435,is the american flight 813 from boston to oakland a flight that goes straight through from boston to oakland without stopping at another city,boston,,oakland,,,,,,,,,,,,,,,,american,,,,,,,,,,,,,,,,,,,,,without stopping,,,,,,813,,,,,,,,,,,,,,,,,,,,,,,,,,,,,,,,,
2436,please list the flights from chicago to kansas city,chicago,,kansas city,,,,,,,,,,,,,,,,,,,,,,,,,,,,,,,,,,,,,,,,,,,,,,,,,,,,,,,,,,,,,,,,,,,,,,,,,,,,
2437,does any airline offer dc10 service between denver and boston,denver,,boston,,,,,,,,,,,,,,,,,,,,,,,,,,,,,,,,,,,,,,,,,,,,,,,,,,,,,,,dc10,,,,,,,,,,,,,,,,,,,,,
2438,what is the seating capacity of a boeing 767,,,,,,,,,,,,,,,,,,,,,,,,,,,,,,,,,,,,,,,,,,,,,,,,,,,,,,,,,,767,,,,,,,,,,,,,,,,,,,,,
2439,i want to travel from kansas city to st. paul and be there by dinnertime,kansas city,,st. paul,,,,dinnertime,,,,,,,,,by,,,,,,,,,,,,,,,,,,,,,,,,,,,,,,,,,,,,,,,,,,,,,,,,,,,,,,,,,,,,,,,
2440,list all flights arriving in pittsburgh monday evening from san francisco that first class,san francisco,,pittsburgh,,evening,,,,,,,,,,,,first class,,,,,,,,,,,,,,,,,,,,,,,,,monday,,,,,,,,,,,,,,,,,,,,,,,,,,,,,,,,,,,,,
2441,what flights from houston to milwaukee on friday on american airlines,houston,,milwaukee,,,friday,,,,,,,,,,,,,american airlines,,,,,,,,,,,,,,,,,,,,,,,,,,,,,,,,,,,,,,,,,,,,,,,,,,,,,,,,,,,,
2442,i would like to book a flight going from tampa to seattle on may twenty sixth i would like to stop in milwaukee on the way,tampa,,seattle,,,,,,,,,,,milwaukee,,,,,,,,,,,twenty sixth,may,,,,,,,,,,,,,,,,,,,,,,,,,,,,,,,,,,,,,,,,,,,,,,,,,,,,,
2443,please list nonstop twa flights from las vegas to new york,las vegas,,new york,,,,,,,,,,,,,,,,,,,,,,,,,,,,,,,,,,,twa,,nonstop,,,,,,,,,,,,,,,,,,,,,,,,,,,,,,,,,,,,,,,
2444,what is airline ff,,,,,,,,,,,,,,,,,,,,,,,,,,,,,,,,,,,,,,ff,,,,,,,,,,,,,,,,,,,,,,,,,,,,,,,,,,,,,,,,,
2445,show me the flights going from pittsburgh to san francisco on monday,pittsburgh,,san francisco,,,monday,,,,,,,,,,,,,,,,,,,,,,,,,,,,,,,,,,,,,,,,,,,,,,,,,,,,,,,,,,,,,,,,,,,,,,,,,
2446,show me all flights arriving to denver from oakland,oakland,,denver,,,,,,,,,,,,,,,,,,,,,,,,,,,,,,,,,,,,,,,,,,,,,,,,,,,,,,,,,,,,,,,,,,,,,,,,,,,,
2447,show me all the one way fares from tacoma to montreal,tacoma,,montreal,,,,,,,one way,,,,,,,,,,,,,,,,,,,,,,,,,,,,,,,,,,,,,,,,,,,,,,,,,,,,,,,,,,,,,,,,,,,,,
2448,please list the cost of all flights from philadelphia to denver airport next sunday,philadelphia,,,,,sunday,,,,,,,,,,,,next,,,,,,,,,,,,,,,,,,,,,,,,,,,,,,,denver airport,,,,,,,,,,,,,,,,,,,,,,,,,,,,,,
2449,i 'd like to travel from boston to baltimore on us air 269 please tell me the times,boston,,baltimore,,,,,times,,,,,,,,,,,us air,,,,,,,,,,,,,,,,,,,,,,,,,,,269,,,,,,,,,,,,,,,,,,,,,,,,,,,,,,,,,
2450,hi i want a round trip ticket to dallas,,,dallas,,,,,,,round trip,,,,,,,,,,,,,,,,,,,,,,,,,,,,,,,,,,,,,,,,,,,,,,,,,,,,,,,,,,,,,,,,,,,,,
2451,i 'm planning a trip to pittsburgh and i live in denver can you help me,denver,,pittsburgh,,,,,,,,,,,,,,,,,,,,,,,,,,,,,,,,,,,,,,,,,,,,,,,,,,,,,,,,,,,,,,,,,,,,,,,,,,,,
2452,which airlines have daily flights from boston to dallas,boston,,dallas,,,,,,,,,,,,,,,,,,,,,,,,,,,,,,,,,,,,,,,,,,,,,daily,,,,,,,,,,,,,,,,,,,,,,,,,,,,,,,
2453,show me the flights from san francisco to newark that leave after 11 pm,san francisco,11 pm,newark,,,,,,,,,,,,,after,,,,,,,,,,,,,,,,,,,,,,,,,,,,,,,,,,,,,,,,,,,,,,,,,,,,,,,,,,,,,,,
2454,list flights leaving dallas on saturday and arriving in san francisco before 4 pm,dallas,,san francisco,4 pm,,saturday,,,,,,,,,,,,,,before,,,,,,,,,,,,,,,,,,,,,,,,,,,,,,,,,,,,,,,,,,,,,,,,,,,,,,,,,,,
2455,what is ff,,,,,,,,,,,,,,,,,,,,,,,,,,,,,,,,,,,,,,ff,,,,,,,,,,,,,,,,,,,,,,,,,,,,,,,,,,,,,,,,,
2456,show me the flights from atlanta to philadelphia,atlanta,,philadelphia,,,,,,,,,,,,,,,,,,,,,,,,,,,,,,,,,,,,,,,,,,,,,,,,,,,,,,,,,,,,,,,,,,,,,,,,,,,,
2457,show me the flights from indianapolis to montreal,indianapolis,,montreal,,,,,,,,,,,,,,,,,,,,,,,,,,,,,,,,,,,,,,,,,,,,,,,,,,,,,,,,,,,,,,,,,,,,,,,,,,,,
2458,what flights are there on sunday from seattle to chicago,seattle,,chicago,,,sunday,,,,,,,,,,,,,,,,,,,,,,,,,,,,,,,,,,,,,,,,,,,,,,,,,,,,,,,,,,,,,,,,,,,,,,,,,
2459,display all flights from st. petersburg and charlotte flights should leave after noon arrive after 5 pm nonstop flight,st. petersburg,noon,charlotte,5 pm,,,,,,,,,,,,after,,,,after,,,,,,,,,,,,,,,,,,,,nonstop,,,,,,,,,,,,,,,,,,,,,,,,,,,,,,,,,,,,,,,
2460,what northwest flights stop in denver,,,,,,,,,,,,,,denver,,,,,northwest,,,,,,,,,,,,,,,,,,,,,,,,,,,,,,,,,,,,,,,,,,,,,,,,,,,,,,,,,,,,
2461,please give me a flight from pittsburgh to san francisco monday,pittsburgh,,san francisco,,,monday,,,,,,,,,,,,,,,,,,,,,,,,,,,,,,,,,,,,,,,,,,,,,,,,,,,,,,,,,,,,,,,,,,,,,,,,,
2462,show me flights from pittsburgh to philadelphia,pittsburgh,,philadelphia,,,,,,,,,,,,,,,,,,,,,,,,,,,,,,,,,,,,,,,,,,,,,,,,,,,,,,,,,,,,,,,,,,,,,,,,,,,,
2463,what ground transportation is available from pittsburgh to downtown,pittsburgh,,,,,,,,,,,,,,,,,,,,,,,,,,,,,,,,,,,,,,,,,,,,,,,,,,,,,,,,,,,,,,,,,,,,,,,,,,,,,,
2464,what is fare class h,,,,,,,,,,,,,,,,,,,,,,,,,,,,h,,,,,,,,,,,,,,,,,,,,,,,,,,,,,,,,,,,,,,,,,,,,,,,,,,,
2465,show me flights with first class reservations from san francisco to pittsburgh for monday,san francisco,,pittsburgh,,,monday,,,,,,,,,,,first class,,,,,,,,,,,,,,,,,,,,,,,,,,,,,,,,,,,,,,,,,,,,,,,,,,,,,,,,,,,,,,
2466,what type of aircraft leaves from boston to washington dc before 9 am,boston,9 am,washington,,,,,,,,,,,,,before,,,,,,,,,,,,,,,,,,dc,,,,,,,,,,,,,,,,,,,,,,,,,,,,,,,,,,,,,,,,,,,,,
2467,delta flights to dallas please,,,dallas,,,,,,,,,,,,,,,,delta,,,,,,,,,,,,,,,,,,,,,,,,,,,,,,,,,,,,,,,,,,,,,,,,,,,,,,,,,,,,
2468,show all airlines flying from pittsburgh to san francisco,pittsburgh,,san francisco,,,,,,,,,,,,,,,,,,,,,,,,,,,,,,,,,,,,,,,,,,,,,,,,,,,,,,,,,,,,,,,,,,,,,,,,,,,,
2469,is there ground transportation in baltimore,,,,,,,,,,,,,baltimore,,,,,,,,,,,,,,,,,,,,,,,,,,,,,,,,,,,,,,,,,,,,,,,,,,,,,,,,,,,,,,,,,,
2470,please list all flights on northwest and united airlines that go to denver,,,denver,,,,,,,,,,,,,,,,united airlines,,,,,,,,,,,,,,,,,,,,,,,,,,,,,,,,,,,,,,,,,,,,,,,,,,,,,,,,,,,,
2471,information on american airlines flight from washington to philadelphia,washington,,philadelphia,,,,,,,,,,,,,,,,american airlines,,,,,,,,,,,,,,,,,,,,,,,,,,,,,,,,,,,,,,,,,,,,,,,,,,,,,,,,,,,,
2472,show me all the information about the flight from baltimore to dallas which is listed dl 1055 dl 405,baltimore,,dallas,,,,,,,,,,,,,,,,,,,,,,,,,,,,,,,,,,,dl,,,,,,,,405,,,,,,,,,,,,,,,,,,,,,,,,,,,,,,,,,
2473,i need the cost of a ticket going from denver to baltimore a first class ticket on united airlines,denver,,baltimore,,,,,,,,,,,,,,first class,,united airlines,,,,,,,,,,,,,,,,,,,,,,,,,,,,,,,,,,,,,,,,,,,,,,,,,,,,,,,,,,,,
2474,which nonstop flight from atlanta to oakland leaves in the afternoon and arrives at 5 pm,atlanta,,oakland,5 pm,afternoon,,,,,,,,,,,,,,,,,,,,,,,,,,,,,,,,,,,nonstop,,,,,,,,,,,,,,,,,,,,,,,,,,,,,,,,,,,,,,,
2475,i need a flight from philadelphia to boston,philadelphia,,boston,,,,,,,,,,,,,,,,,,,,,,,,,,,,,,,,,,,,,,,,,,,,,,,,,,,,,,,,,,,,,,,,,,,,,,,,,,,,
2476,what is the ground transportation in san diego,,,,,,,,,,,,,san diego,,,,,,,,,,,,,,,,,,,,,,,,,,,,,,,,,,,,,,,,,,,,,,,,,,,,,,,,,,,,,,,,,,
2477,is there a flight between san francisco and boston with a stopover in dallas fort worth,san francisco,,boston,,,,,,,,,,,dallas fort worth,,,,,,,,,,,,,,,,,,,,,,,,,,,,,,,,,,,,,,,,,,,,,,,,,,,,,,,,,,,,,,,,,
2478,show me all flights from baltimore to san francisco,baltimore,,san francisco,,,,,,,,,,,,,,,,,,,,,,,,,,,,,,,,,,,,,,,,,,,,,,,,,,,,,,,,,,,,,,,,,,,,,,,,,,,,
2479,i would like a flight from philadelphia to dallas,philadelphia,,dallas,,,,,,,,,,,,,,,,,,,,,,,,,,,,,,,,,,,,,,,,,,,,,,,,,,,,,,,,,,,,,,,,,,,,,,,,,,,,
2480,now i need a one way flight from pittsburgh to denver,pittsburgh,,denver,,,,,,,one way,,,,,,,,,,,,,,,,,,,,,,,,,,,,,,,,,,,,,,,,,,,,,,,,,,,,,,,,,,,,,,,,,,,,,
2481,i want a flight from pittsburgh to los angeles that departs after 6 pm on thursday,pittsburgh,6 pm,los angeles,,,thursday,,,,,,,,,,after,,,,,,,,,,,,,,,,,,,,,,,,,,,,,,,,,,,,,,,,,,,,,,,,,,,,,,,,,,,,,,,
2482,show me the flights from san francisco to boston,san francisco,,boston,,,,,,,,,,,,,,,,,,,,,,,,,,,,,,,,,,,,,,,,,,,,,,,,,,,,,,,,,,,,,,,,,,,,,,,,,,,,
2483,how many first class flights are provided by american airlines,,,,,,,,,,,,,,,,,first class,,american airlines,,,,,,,,,,,,,,,,,,,,,,,,,,,,,,,,,,,,,,,,,,,,,,,,,,,,,,,,,,,,
2484,show me all flights from pittsburgh to dallas,pittsburgh,,dallas,,,,,,,,,,,,,,,,,,,,,,,,,,,,,,,,,,,,,,,,,,,,,,,,,,,,,,,,,,,,,,,,,,,,,,,,,,,,
2485,what ground transportation is available at boston,,,,,,,,,,,,,boston,,,,,,,,,,,,,,,,,,,,,,,,,,,,,,,,,,,,,,,,,,,,,,,,,,,,,,,,,,,,,,,,,,
2486,what is the earliest flight from boston to atlanta,boston,,atlanta,,,,,,,,,,,,,,,,,,,,,,,,,,,earliest,,,,,,,,,,,,,,,,,,,,,,,,,,,,,,,,,,,,,,,,,,,,,,,,,
2487,is there limo service at pittsburgh airport,,,,,,,,,,,,,,,,,,,,,,,,,,,,,limo,,,,,,,,,,,,,,,,,,,,,,,,,,,,,,,,,pittsburgh airport,,,,,,,,,,,,,,,,,
2488,please show me flights which cost less than or equal to 466 dollars from new york to miami leaving on a tuesday,new york,,miami,,,tuesday,,,less,,466 dollars,,,,,,,,,,,,,,,,,,,,,,,,,,,,,,,,,,,,,,,,,,,,,,,,,,,,,,,,,,,,,,,,,,,,
2489,give me return flights from philadelphia to san francisco for december third,philadelphia,,san francisco,,,,,,,return,,,,,,,,,,,,,,,third,december,,,,,,,,,,,,,,,,,,,,,,,,,,,,,,,,,,,,,,,,,,,,,,,,,,,,,
2490,show me the latest flight from las vegas to denver,las vegas,,denver,,,,,,,,,,,,,,,,,,,,,,,,,,,latest,,,,,,,,,,,,,,,,,,,,,,,,,,,,,,,,,,,,,,,,,,,,,,,,,
2491,list the flights from indianapolis to houston,indianapolis,,houston,,,,,,,,,,,,,,,,,,,,,,,,,,,,,,,,,,,,,,,,,,,,,,,,,,,,,,,,,,,,,,,,,,,,,,,,,,,,
2492,what is the earliest flight that eastern has between boston and washington,boston,,washington,,,,,,,,,,,,,,,,eastern,,,,,,,,,,,earliest,,,,,,,,,,,,,,,,,,,,,,,,,,,,,,,,,,,,,,,,,,,,,,,,,
2493,give me the flights from kansas city to chicago leaving next wednesday arriving at chicago at about 7 pm,kansas city,,chicago,7 pm,,wednesday,,,,,,,,,,,,next,,about,,,,,,,,,,,,,,,,,,,,,,,,,,,,,,,,,,,,,,,,,,,,,,,,,,,,,,,,,,,
2494,all right what i 'd like to do is find the cheapest one way fare from boston to denver,boston,,denver,,,,,,cheapest,one way,,,,,,,,,,,,,,,,,,,,,,,,,,,,,,,,,,,,,,,,,,,,,,,,,,,,,,,,,,,,,,,,,,,,,
2495,show me a list of flights from pittsburgh to baltimore on august third,pittsburgh,,baltimore,,,,,,,,,,,,,,,,,,,,,,third,august,,,,,,,,,,,,,,,,,,,,,,,,,,,,,,,,,,,,,,,,,,,,,,,,,,,,,
2496,what airlines are ac and as,,,,,,,,,,,,,,,,,,,,,,,,,,,,,,,,,,,,,,as,,,,,,,,,,,,,,,,,,,,,,,,,,,,,,,,,,,,,,,,,
2497,i 'd like to see the flights from baltimore to philadelphia,baltimore,,philadelphia,,,,,,,,,,,,,,,,,,,,,,,,,,,,,,,,,,,,,,,,,,,,,,,,,,,,,,,,,,,,,,,,,,,,,,,,,,,,
2498,how much does a first class round trip ticket from cleveland to miami on us air cost,cleveland,,miami,,,,,,,round trip,,,,,,,first class,,us air,,,,,,,,,,,,,,,,,,,,,,,,,,,,,,,,,,,,,,,,,,,,,,,,,,,,,,,,,,,,
2499,what are all the flights into atlanta 's airport,,,atlanta 's,,,,,,,,,,,,,,,,,,,,,,,,,,,,,,,,,,,,,,,,,,,,,,,,,,,,,,,,,,,,,,,,,,,,,,,,,,,,
2500,show me flights from pittsburgh to philadelphia on wednesday morning,pittsburgh,,philadelphia,,,wednesday,morning,,,,,,,,,,,,,,,,,,,,,,,,,,,,,,,,,,,,,,,,,,,,,,,,,,,,,,,,,,,,,,,,,,,,,,,,
2501,what 's the earliest flight leaving denver for pittsburgh,denver,,pittsburgh,,,,,,,,,,,,,,,,,,,,,,,,,,,earliest,,,,,,,,,,,,,,,,,,,,,,,,,,,,,,,,,,,,,,,,,,,,,,,,,
2502,tell me about flights from atlanta to charlotte north carolina leaving on monday and arriving in charlotte,atlanta,,charlotte,,,monday,,,,,,,,,,,,,,,,,,north carolina,,,,,,,,,,,,,,,,,,,,,,,,,,,,,,,,,,,,,,,,,,,,,,,,,,,,,,,
2503,i want to fly from miami to chicago on american airlines and arrive at around 5 o'clock in the afternoon show me all flights,miami,,chicago,5 o'clock,afternoon,,,,,,,,,,,,,,american airlines,around,,,,,,,,,,,,,,,,,,,,,,,,,,,,,,,,,,,,,,,,,,,,,,,,,,,,,,,,,,,
2504,what flights from st. louis to st. paul on thursday leaving after 10 am,st. louis,10 am,st. paul,,,thursday,,,,,,,,,,after,,,,,,,,,,,,,,,,,,,,,,,,,,,,,,,,,,,,,,,,,,,,,,,,,,,,,,,,,,,,,,,
2505,please list the flights from new york to los angeles,new york,,los angeles,,,,,,,,,,,,,,,,,,,,,,,,,,,,,,,,,,,,,,,,,,,,,,,,,,,,,,,,,,,,,,,,,,,,,,,,,,,,
2506,are there any flights from denver to atlanta to pittsburgh,denver,,pittsburgh,,,,,,,,,,,,,,,,,,,,,,,,,,,,,,,,,,,,,,,,,,,,,,,,,,,,,,,,,,,,,,,,,,,,,,,,,,,,
2507,what first class airplane goes from philadelphia to san francisco and stops in dallas in the afternoon on monday,philadelphia,,san francisco,,,monday,afternoon,,,,,,,dallas,,,first class,,,,,,,,,,,,,,,,,,,,,,,,,,,,,,,,,,,,,,,,,,,,,,,,,,,,,,,,,,,,,,
2508,show flights from denver to oakland,denver,,oakland,,,,,,,,,,,,,,,,,,,,,,,,,,,,,,,,,,,,,,,,,,,,,,,,,,,,,,,,,,,,,,,,,,,,,,,,,,,,
2509,cheapest fare from indianapolis to seattle,indianapolis,,seattle,,,,,,cheapest,,,,,,,,,,,,,,,,,,,,,,,,,,,,,,,,,,,,,,,,,,,,,,,,,,,,,,,,,,,,,,,,,,,,,,
