1186,please list all flights from dallas to philadelphia on monday,dallas,,philadelphia,,,monday,,,,,,,,,,,,,,,,,,,,,,,,,,,,,,,,,,,,,,,,,,,,,,,,,,,,,,,,,,,,,,,,,,,,,,,,,
1187,list all united flights from boston to san francisco,boston,,san francisco,,,,,,,,,,,,,,,,united,,,,,,,,,,,,,,,,,,,,,,,,,,,,,,,,,,,,,,,,,,,,,,,,,,,,,,,,,,,,
1188,are there any flights from boston to san francisco with a stopover in dallas,boston,,san francisco,,,,,,,,,,,dallas,,,,,,,,,,,,,,,,,,,,,,,,,,,,,,,,,,,,,,,,,,,,,,,,,,,,,,,,,,,,,,,,,
1189,i need a flight from san francisco to pittsburgh from pittsburgh to new york and then new york to san francisco,new york,,san francisco,,,,,,,,,,,,,,,,,,,,,,,,,,,,,,,,,,,,,,,,,,,,,,,,,,,,,,,,,,,,,,,,,,,,,,,,,,,,
1190,what flights from atlanta to st. louis on tuesday arriving around 230 pm,atlanta,,st. louis,230 pm,,tuesday,,,,,,,,,,,,,,around,,,,,,,,,,,,,,,,,,,,,,,,,,,,,,,,,,,,,,,,,,,,,,,,,,,,,,,,,,,
1191,show me the flights to love field from all other airports,,,,,,,,,,,,,,,,,,,,,,,,,,,,,,,,,,,,,,,,,,,,,,,,,love field,,,,,,,,,,,,,,,,,,,,,,,,,,,,,,
1192,show me all flights from montreal,montreal,,,,,,,,,,,,,,,,,,,,,,,,,,,,,,,,,,,,,,,,,,,,,,,,,,,,,,,,,,,,,,,,,,,,,,,,,,,,,,
1193,is there a flight departing from san francisco and arriving in oakland on november seventh in the evening,san francisco,,oakland,,evening,,,,,,,,,,,,,,,,,,,,,,,,,,november,seventh,,,,,,,,,,,,,,,,,,,,,,,,,,,,,,,,,,,,,,,,,,,,,,,
1194,show me the flights from denver to westchester county,denver,,westchester county,,,,,,,,,,,,,,,,,,,,,,,,,,,,,,,,,,,,,,,,,,,,,,,,,,,,,,,,,,,,,,,,,,,,,,,,,,,,
1195,can you tell me the latest evening flight from atlanta to denver on july seventh,atlanta,,denver,,,,evening,,,,,,,,,,,,,,,,,,seventh,july,,,,latest,,,,,,,,,,,,,,,,,,,,,,,,,,,,,,,,,,,,,,,,,,,,,,,,,
1196,show me all flights from denver or philadelphia or pittsburgh to baltimore,pittsburgh,,baltimore,,,,,,,,,,,,,,,,,,,,,,,,,,,,,,,,,,,,,,,,,or,,,,,,,,,,,,,,,,,,,,,,,,,,,,,,,,,,,
1197,flights from las vegas to montreal,las vegas,,montreal,,,,,,,,,,,,,,,,,,,,,,,,,,,,,,,,,,,,,,,,,,,,,,,,,,,,,,,,,,,,,,,,,,,,,,,,,,,,
1198,does midwest express serve cleveland,,,,,,,,,,,,,cleveland,,,,,,midwest,,,,,,,,,,,,,,,,,,,,,,,,,,,,,,,,,,,,,,,,,,,,,,,,,,,,,,,,,,,,
1199,what kind of aircraft does delta fly before 8 am on august second from boston to denver,boston,8 am,denver,,,,,,,,,,,,,before,,,delta,,,,,,second,august,,,,,,,,,,,,,,,,,,,,,,,,,,,,,,,,,,,,,,,,,,,,,,,,,,,,,
1200,list all flights arriving and departing at general mitchell international,,,,,,,,,,,,,,,,,,,,,,,general mitchell international,,,,,,,,,,,,,,,,,,,,,,,,,,,,,,,,,,,,,,,,,,,,,,,,,,,,,,,,
1201,what is the cheapest one way fare from atlanta to boston,atlanta,,boston,,,,,,cheapest,one way,,,,,,,,,,,,,,,,,,,,,,,,,,,,,,,,,,,,,,,,,,,,,,,,,,,,,,,,,,,,,,,,,,,,,
1202,okay i 'm looking for a flight from tampa to st. louis leaving before 10 am any day,tampa,10 am,st. louis,,,,,,,,,,,,,before,,,,,,,,,,,,,,,,,,,,,,,,,,,,,,,,,,,,,,,,,,,,,,,,,,,,,,,,,,,,,,,
1203,what are all flights from boston to denver,boston,,denver,,,,,,,,,,,,,,,,,,,,,,,,,,,,,,,,,,,,,,,,,,,,,,,,,,,,,,,,,,,,,,,,,,,,,,,,,,,,
1204,can you give me information on transportation from the airport in philadelphia to downtown philadelphia,philadelphia,,philadelphia,,,,,,,,,,,,,,,,,,,,,,,,,,,,,,,,,,,,,,,,,,,,,,,,,,,,,,,,,,,,,,,,,,,,,,,,,,,,
1205,give me a flight from memphis to las vegas and new york city to las vegas on sunday that arrive at the same time,new york city,,las vegas,,,sunday,,,,,,,,,,,,,,,,,,,,,,,,,,,,,,,,,,,,,,,,,,,,,,,,,,,,,,,,,,,,,,,,,,,,,,,,,
1206,what kind of airplane goes from philadelphia to san francisco monday stopping in dallas in the afternoon first class flight,philadelphia,,san francisco,,,monday,afternoon,,,,,,,dallas,,,first class,,,,,,,,,,,,,,,,,,,,,,,,,,,,,,,,,,,,,,,,,,,,,,,,,,,,,,,,,,,,,,
1207,list all flights on continental departing on monday before noon from denver to chicago,denver,noon,chicago,,,monday,,,,,,,,,,before,,,continental,,,,,,,,,,,,,,,,,,,,,,,,,,,,,,,,,,,,,,,,,,,,,,,,,,,,,,,,,,,,
1208,i would like to know the first class fare on a flight from baltimore to denver,baltimore,,denver,,,,,,,,,,,,,,first class,,,,,,,,,,,,,,,,,,,,,,,,,,,,,,,,,,,,,,,,,,,,,,,,,,,,,,,,,,,,,,
1209,flights from newark to cleveland 5 o'clock pm daily,newark,5 o'clock pm,cleveland,,,,,,,,,,,,,,,,,,,,,,,,,,,,,,,,,,,,,,,,,,,,,daily,,,,,,,,,,,,,,,,,,,,,,,,,,,,,,,
1210,what is the cheapest fare between boston and san francisco,boston,,san francisco,,,,,,cheapest,,,,,,,,,,,,,,,,,,,,,,,,,,,,,,,,,,,,,,,,,,,,,,,,,,,,,,,,,,,,,,,,,,,,,,
1211,on tuesday i 'd like to fly from detroit to st. petersburg,detroit,,st. petersburg,,,tuesday,,,,,,,,,,,,,,,,,,,,,,,,,,,,,,,,,,,,,,,,,,,,,,,,,,,,,,,,,,,,,,,,,,,,,,,,,
1212,find a flight from san francisco to boston on wednesday,san francisco,,boston,,,wednesday,,,,,,,,,,,,,,,,,,,,,,,,,,,,,,,,,,,,,,,,,,,,,,,,,,,,,,,,,,,,,,,,,,,,,,,,,
1213,what is the cheapest flight from dallas to baltimore,dallas,,baltimore,,,,,,cheapest,,,,,,,,,,,,,,,,,,,,,,,,,,,,,,,,,,,,,,,,,,,,,,,,,,,,,,,,,,,,,,,,,,,,,,
1214,what flights are there from newark to seattle on saturday,newark,,seattle,,,saturday,,,,,,,,,,,,,,,,,,,,,,,,,,,,,,,,,,,,,,,,,,,,,,,,,,,,,,,,,,,,,,,,,,,,,,,,,
1215,please list all the takeoffs and landings for general mitchell international,,,,,,,,,,,,,,,,,,,,,,,,,,,,,,,,,,,,,,,,,,,,,,,,,,,,,,,,,,,,,,general mitchell international,,,,,,,,,,,,,,,,,
1216,please list the morning flights from kansas city to atlanta,kansas city,,atlanta,,,,morning,,,,,,,,,,,,,,,,,,,,,,,,,,,,,,,,,,,,,,,,,,,,,,,,,,,,,,,,,,,,,,,,,,,,,,,,
1217,i want to leave boston at 838 and arrive in denver at 1110 in the morning,boston,838,denver,1110,morning,,,,,,,,,,,,,,,,,,,,,,,,,,,,,,,,,,,,,,,,,,,,,,,,,,,,,,,,,,,,,,,,,,,,,,,,,,
1218,i would like one flight from kansas city to st. paul arriving around dinnertime 6 pm,kansas city,,st. paul,,dinnertime,,,,,,,,,,,,,,,around,,,,,,,,,,,,,,,,,,,,,,,,,,,,,,,,,,,,,,,,,,,,,,,,,,,,,,,,,,,
1219,list nonstop flights from baltimore to newark on wednesday before noon,baltimore,,newark,noon,,,,,,,,,,,,,,,,before,,,,,,,,,,,,,,,,,,,,nonstop,,wednesday,,,,,,,,,,,,,,,,,,,,,,,,,,,,,,,,,,,,,
1220,i 'm looking for a flight traveling from boston to denver one way and the cheapest way possible,boston,,denver,,,,,,cheapest,one way,,,,,,,,,,,,,,,,,,,,,,,,,,,,,,,,,,,,,,,,,,,,,,,,,,,,,,,,,,,,,,,,,,,,,
1221,what ground transportation is available at the boston airport,,,,,,,,,,,,,,,,,,,,,,,,,,,,,,,,,,,,,,,,,,,,,,,,,,,,,,,,,,,,,,boston airport,,,,,,,,,,,,,,,,,
1222,what type of aircraft is used on american airline flight 315,,,,,,,,,,,,,,,,,,,american airline,,,,,,,,,,,,,,,,,,,,,,,,,,,315,,,,,,,,,,,,,,,,,,,,,,,,,,,,,,,,,
1223,explain restriction ap please,,,,,,,,,,,,,,,,,,,,,,,,,,,,,,,,,,,,,,,,,,,,,,,,,,,,,,,,,,,,,ap,,,,,,,,,,,,,,,,,,
1224,i would like a us air flight from toronto to san diego with a stopover in denver please,toronto,,san diego,,,,,,,,,,,denver,,,,,us air,,,,,,,,,,,,,,,,,,,,,,,,,,,,,,,,,,,,,,,,,,,,,,,,,,,,,,,,,,,,
1225,what is the lowest fare from denver to atlanta,denver,,atlanta,,,,,,lowest,,,,,,,,,,,,,,,,,,,,,,,,,,,,,,,,,,,,,,,,,,,,,,,,,,,,,,,,,,,,,,,,,,,,,,
1226,what flights are there from new york city to las vegas,new york city,,las vegas,,,,,,,,,,,,,,,,,,,,,,,,,,,,,,,,,,,,,,,,,,,,,,,,,,,,,,,,,,,,,,,,,,,,,,,,,,,,
1227,how long does it take to get from kansas city to st. paul,kansas city,,st. paul,,,,,,,,,,,,,,,,,,,,,,,,,,,,,,,,,,,,,,,,,,,,,,,,,,,,,,,,,,,,,,,,,,,,,,,,,,,,
1228,i would like a flight from kansas city to st. paul departing at 4 pm,kansas city,4 pm,st. paul,,,,,,,,,,,,,,,,,,,,,,,,,,,,,,,,,,,,,,,,,,,,,,,,,,,,,,,,,,,,,,,,,,,,,,,,,,,,
1229,what is the round trip fare on continental 1291 from dallas to san francisco and return,dallas,,san francisco,,,,,,,return,,,,,,,,,continental,,,,,,,,,,,,,,,,,,,,,,,,,,,1291,,,,,,,,,,,,,,,,,,,,,,,,,,,,,,,,,
1230,i want to go and take a plane in atlanta and fly to boston,atlanta,,boston,,,,,,,,,,,,,,,,,,,,,,,,,,,,,,,,,,,,,,,,,,,,,,,,,,,,,,,,,,,,,,,,,,,,,,,,,,,,
1231,i 'd like a flight leaving atlanta august seventh and arriving in denver colorado august seventh leaving in the afternoon,atlanta,,denver,,,,afternoon,,,,,,,,,,,,,,,,,colorado,seventh,august,,,,,august,seventh,,,,,,,,,,,,,,,,,,,,,,,,,,,,,,,,,,,,,,,,,,,,,,,
1232,show first flight from philadelphia to dallas,philadelphia,,dallas,,,,,,,,,,,,,,,,,,,,,,,,,,,first,,,,,,,,,,,,,,,,,,,,,,,,,,,,,,,,,,,,,,,,,,,,,,,,,
1233,list the flights from philadelphia to dallas on american airlines,philadelphia,,dallas,,,,,,,,,,,,,,,,american airlines,,,,,,,,,,,,,,,,,,,,,,,,,,,,,,,,,,,,,,,,,,,,,,,,,,,,,,,,,,,,
1234,find a nonstop flight between boston and washington arriving in washington around 5 pm,boston,,washington,5 pm,,,,,,,,,,,,,,,,around,,,,,,,,,,,,,,,,,,,,nonstop,,,,,,,,,,,,,,,,,,,,,,,,,,,,,,,,,,,,,,,
1235,give me the continental flights from chicago to seattle on saturday morning,chicago,,seattle,,,saturday,morning,,,,,,,,,,,,continental,,,,,,,,,,,,,,,,,,,,,,,,,,,,,,,,,,,,,,,,,,,,,,,,,,,,,,,,,,,,
1236,what ground transportation is available in dallas tomorrow,,,,,,,,,,,,,dallas,,,,,,,,,,,,,,,,,,,,,,,,,,,,,,,,,,,,,,,,,,,,,,,,,,,,,,tomorrow,,,,,,,,,,,,
1237,show me all flights from pittsburgh to boston both direct and connecting that depart pittsburgh after 7 pm,pittsburgh,7 pm,boston,,,,,,,,,,,,,after,,,,,,,,,,,,,,,,,,,,,,,,,,,,,,,,,,,,,,,,,,,,,,,,,,,,,,,,,,,,,,,
1238,show me the flights from pittsburgh to baltimore,pittsburgh,,baltimore,,,,,,,,,,,,,,,,,,,,,,,,,,,,,,,,,,,,,,,,,,,,,,,,,,,,,,,,,,,,,,,,,,,,,,,,,,,,
1239,show me all the flights from montreal to detroit,montreal,,detroit,,,,,,,,,,,,,,,,,,,,,,,,,,,,,,,,,,,,,,,,,,,,,,,,,,,,,,,,,,,,,,,,,,,,,,,,,,,,
1240,show me all flights from san francisco to la guardia nonstop,san francisco,,,,,,,,,,,,,,,,,,,,,,,,,,,,,,,,,,,,,,,nonstop,,,,,,,,,la guardia,,,,,,,,,,,,,,,,,,,,,,,,,,,,,,
1241,show me flights from philadelphia to baltimore,philadelphia,,baltimore,,,,,,,,,,,,,,,,,,,,,,,,,,,,,,,,,,,,,,,,,,,,,,,,,,,,,,,,,,,,,,,,,,,,,,,,,,,,
1242,show me all the delta flights leaving pittsburgh between 12 and 4 in the afternoon,pittsburgh,,,,,,afternoon,,,,,,,,,,,,delta,,12,4,,,,,,,,,,,,,,,,,,,,,,,,,,,,,,,,,,,,,,,,,,,,,,,,,,,,,,,,,
1243,could you please show me all flights from charlotte to milwaukee,charlotte,,milwaukee,,,,,,,,,,,,,,,,,,,,,,,,,,,,,,,,,,,,,,,,,,,,,,,,,,,,,,,,,,,,,,,,,,,,,,,,,,,,
1244,i 'd like to find the earliest flight possible from san francisco to atlanta,san francisco,,atlanta,,,,,,,,,,,,,,,,,,,,,,,,,,,earliest,,,,,,,,,,,,,,,,,,,,,,,,,,,,,,,,,,,,,,,,,,,,,,,,,
1245,what flights are available on wednesday from atlanta to washington dc,atlanta,,washington,,,wednesday,,,,,,,,,,,,,,,,,,,,,,,,,,,,dc,,,,,,,,,,,,,,,,,,,,,,,,,,,,,,,,,,,,,,,,,,,,,
1246,i would like information information on flights from san francisco to denver on thursday morning,san francisco,,denver,,,thursday,morning,,,,,,,,,,,,,,,,,,,,,,,,,,,,,,,,,,,,,,,,,,,,,,,,,,,,,,,,,,,,,,,,,,,,,,,,
1247,please list the flights from st. paul to kansas city on friday night that serve meals,st. paul,,kansas city,,,friday,night,,,,,,,,,,,,,,,,,,,,,,,,,,meals,,,,,,,,,,,,,,,,,,,,,,,,,,,,,,,,,,,,,,,,,,,,,,
1248,flights from chicago to denver on continental on saturday morning,chicago,,denver,,,saturday,morning,,,,,,,,,,,,continental,,,,,,,,,,,,,,,,,,,,,,,,,,,,,,,,,,,,,,,,,,,,,,,,,,,,,,,,,,,,
1249,i need a return flight from chicago to kansas city leaving chicago around 7 in the evening on the day following next wednesday,chicago,7,kansas city,,,wednesday,evening,,,return,,,,,,around,,following,,,,,,,,,,,,,,,,,,,,,,,,,,,,,,,,,,,,,,,,,,,,,,,,,,,,,,,,,,,,,
1250,i would like the fare on the us air 1039 from denver to pittsburgh on april twenty,denver,,pittsburgh,,,,,,,,,,,,,,,,us air,,,,,,twenty,april,,,,,,,,,,,,,,,,,,,,1039,,,,,,,,,,,,,,,,,,,,,,,,,,,,,,,,,
1251,what is the cheapest way to travel round trip from milwaukee to san francisco,milwaukee,,san francisco,,,,,,cheapest,round trip,,,,,,,,,,,,,,,,,,,,,,,,,,,,,,,,,,,,,,,,,,,,,,,,,,,,,,,,,,,,,,,,,,,,,
1252,what 're the lowest one way fares from denver to atlanta,denver,,atlanta,,,,,,lowest,one way,,,,,,,,,,,,,,,,,,,,,,,,,,,,,,,,,,,,,,,,,,,,,,,,,,,,,,,,,,,,,,,,,,,,,
1253,what flights are there from pittsburgh to san francisco on friday,pittsburgh,,san francisco,,,friday,,,,,,,,,,,,,,,,,,,,,,,,,,,,,,,,,,,,,,,,,,,,,,,,,,,,,,,,,,,,,,,,,,,,,,,,,
1254,flights from la guardia to jfk,,,,,,,,,,,,,,,jfk,,,,,,,,la guardia,,,,,,,,,,,,,,,,,,,,,,,,,,,,,,,,,,,,,,,,,,,,,,,,,,,,,,,,
1255,please show me the return flight number from toronto to st. petersburg,toronto,,st. petersburg,,,,,,,,,,,,,,,,,,,,,,,,,,,,,,,,,,,,,,,,,,,,,,,,,,,,,,,,,,,,,,,,,,,,,,,,,,,,
1256,find me the earliest boston departure for atlanta and the lastest return trip from atlanta so that i can be in atlanta the longest amount of time but return to boston the same day,atlanta,,boston,,,,,,,,,,,,,,,,,,,,,,,,,,,lastest,,,,,,,,,,,,,,,,,,,,,,,,,,day,,,,,,,,,,,,,,,,,,,,,,,
1257,an american airlines flight first class from philadelphia to dallas,philadelphia,,dallas,,,,,,,,,,,,,,first class,,american airlines,,,,,,,,,,,,,,,,,,,,,,,,,,,,,,,,,,,,,,,,,,,,,,,,,,,,,,,,,,,,
1258,list the flights from houston to st. paul,houston,,st. paul,,,,,,,,,,,,,,,,,,,,,,,,,,,,,,,,,,,,,,,,,,,,,,,,,,,,,,,,,,,,,,,,,,,,,,,,,,,,
1259,i would like to see the economy fares for denver to philadelphia,denver,,philadelphia,,,,,,,,,,,,,,,,,,,,,,,,,,,,,,,,,,,,,,,,,,economy,,,,,,,,,,,,,,,,,,,,,,,,,,,,,,,,,,
1260,what are the flights from kansas city to burbank on saturday may twenty two on america west,kansas city,,burbank,,,saturday,,,,,,,,,,,,,america west,,,,,,twenty two,may,,,,,,,,,,,,,,,,,,,,,,,,,,,,,,,,,,,,,,,,,,,,,,,,,,,,,
1261,flights from st. paul to houston,st. paul,,houston,,,,,,,,,,,,,,,,,,,,,,,,,,,,,,,,,,,,,,,,,,,,,,,,,,,,,,,,,,,,,,,,,,,,,,,,,,,,
1262,show me the aircraft that canadian airlines uses,,,,,,,,,,,,,,,,,,,canadian airlines,,,,,,,,,,,,,,,,,,,,,,,,,,,,,,,,,,,,,,,,,,,,,,,,,,,,,,,,,,,,
1263,which airlines have flights from san francisco to washington by way of indianapolis,san francisco,,washington,,,,,,,,,,,indianapolis,,,,,,,,,,,,,,,,,,,,,,,,,,,,,,,,,,,,,,,,,,,,,,,,,,,,,,,,,,,,,,,,,
1264,are there any flights from boston to san francisco which stop in washington dc,boston,,san francisco,,,,,,,,,,,washington,,,,,,,,,,,,,,,,,,,,,,,,,,,,,,,,,,,,,,,,,,,,,,,,,,,,,,dc,,,,,,,,,,,
1265,all flights from boston to washington dc on november eleventh before 10 am,boston,10 am,washington,,,,,,,,,,,,,before,,,,,,,,,eleventh,november,,,,,,,,dc,,,,,,,,,,,,,,,,,,,,,,,,,,,,,,,,,,,,,,,,,,,,,
1266,denver to philadelphia monday,denver,,philadelphia,,,monday,,,,,,,,,,,,,,,,,,,,,,,,,,,,,,,,,,,,,,,,,,,,,,,,,,,,,,,,,,,,,,,,,,,,,,,,,
1267,nonstop flights denver to kansas city,,,kansas city,,,,,,,,,,,,,,,,,,,,,,,,,,,,,,,,,,,,,nonstop,,,,,,,,,,,,,,,,,,,,,,,,,,,,,,,,,,,,,,,
1268,i would like direct coach flights from pittsburgh to atlanta,pittsburgh,,atlanta,,,,,,,,,,,,,,coach,,,,,,,,,,,,,,,,,,,,,,,,,,,,,,,,,,,,,,,,,,,direct,,,,,,,,,,,,,,,,,,,
1269,what flights are there arriving in chicago on continental after 11 pm,,,chicago,11 pm,,,,,,,,,,,,,,,continental,after,,,,,,,,,,,,,,,,,,,,,,,,,,,,,,,,,,,,,,,,,,,,,,,,,,,,,,,,,,,
1270,can you list all nonstop flights departing from st. petersburg and arriving in charlotte,st. petersburg,,charlotte,,,,,,,,,,,,,,,,,,,,,,,,,,,,,,,,,,,,,nonstop,,,,,,,,,,,,,,,,,,,,,,,,,,,,,,,,,,,,,,,
1271,what is the type of aircraft for united flight 21,,,,,,,,,,,,,,,,,,,united,,,,,,,,,,,,,,,,,,,,,,,,,,,21,,,,,,,,,,,,,,,,,,,,,,,,,,,,,,,,,
1272,can you tell me about flights from san jose to nashville on saturday afternoon,san jose,,nashville,,,saturday,afternoon,,,,,,,,,,,,,,,,,,,,,,,,,,,,,,,,,,,,,,,,,,,,,,,,,,,,,,,,,,,,,,,,,,,,,,,,
1273,please give me flights available from denver to philadelphia,denver,,philadelphia,,,,,,,,,,,,,,,,,,,,,,,,,,,,,,,,,,,,,,,,,,,,,,,,,,,,,,,,,,,,,,,,,,,,,,,,,,,,
1274,round trip air fares from baltimore to philadelphia less than 1000 dollars,baltimore,,philadelphia,,,,,,less,round trip,1000 dollars,,,,,,,,,,,,,,,,,,,,,,,,,,,,,,,,,,,,,,,,,,,,,,,,,,,,,,,,,,,,,,,,,,,,
1275,dallas to oakland saturday,dallas,,oakland,,,saturday,,,,,,,,,,,,,,,,,,,,,,,,,,,,,,,,,,,,,,,,,,,,,,,,,,,,,,,,,,,,,,,,,,,,,,,,,
1276,what aircraft is used on delta flight 1222 from kansas city to salt lake city,kansas city,,salt lake city,,,,,,,,,,,,,,,,delta,,,,,,,,,,,,,,,,,,,,,,,,,,,1222,,,,,,,,,,,,,,,,,,,,,,,,,,,,,,,,,
1277,i need to go from philadelphia to dallas,philadelphia,,dallas,,,,,,,,,,,,,,,,,,,,,,,,,,,,,,,,,,,,,,,,,,,,,,,,,,,,,,,,,,,,,,,,,,,,,,,,,,,,
1278,how many flights does american airlines have from boston to atlanta,boston,,atlanta,,,,,,,,,,,,,,,,american airlines,,,,,,,,,,,,,,,,,,,,,,,,,,,,,,,,,,,,,,,,,,,,,,,,,,,,,,,,,,,,
1279,only show continental flights,,,,,,,,,,,,,,,,,,,continental,,,,,,,,,,,,,,,,,,,,,,,,,,,,,,,,,,,,,,,,,,,,,,,,,,,,,,,,,,,,
1280,what is restriction ap 80,,,,,,,,,,,,,,,,,,,,,,,,,,,,,,,,,,,,,,,,,,,,,,,,,,,,,,,,,,,,,ap 80,,,,,,,,,,,,,,,,,,
1281,oakland to denver,oakland,,denver,,,,,,,,,,,,,,,,,,,,,,,,,,,,,,,,,,,,,,,,,,,,,,,,,,,,,,,,,,,,,,,,,,,,,,,,,,,,
1282,show me flights between new york city and las vegas on sunday,new york city,,las vegas,,,sunday,,,,,,,,,,,,,,,,,,,,,,,,,,,,,,,,,,,,,,,,,,,,,,,,,,,,,,,,,,,,,,,,,,,,,,,,,
1283,can you tell me the flights on october fifteenth 1991 from boston to oakland,boston,,oakland,,,,,,,,,,,,,,,,,,,,,,fifteenth,october,,,,,,,,,,,,,,,,,,,,,,,,,,,,,1991,,,,,,,,,,,,,,,,,,,,,,,,
1284,what flights from chicago to denver in the morning,chicago,,denver,,,,morning,,,,,,,,,,,,,,,,,,,,,,,,,,,,,,,,,,,,,,,,,,,,,,,,,,,,,,,,,,,,,,,,,,,,,,,,
1285,what are the flights from washington dc to denver,washington,,denver,,,,,,,,,,,,,,,,,,,,,,,,,,,,,,,,,,,,,,,,,,,,,,,,,,,,,,,,dc,,,,,,,,,,,,,,,,,,,,
1286,i would like an evening flight from pittsburgh to los angeles on june third,pittsburgh,,los angeles,,,,evening,,,,,,,,,,,,,,,,,,third,june,,,,,,,,,,,,,,,,,,,,,,,,,,,,,,,,,,,,,,,,,,,,,,,,,,,,,
1287,from las vegas to phoenix departing in the morning,las vegas,,phoenix,,,,morning,,,,,,,,,,,,,,,,,,,,,,,,,,,,,,,,,,,,,,,,,,,,,,,,,,,,,,,,,,,,,,,,,,,,,,,,
1288,flights from milwaukee to phoenix on saturday or sunday american airlines,milwaukee,,phoenix,,,sunday,,,,,,,,,,,,,american airlines,,,,,,,,,,,,,,,,,,,,,,,,,or,,,,,,,,,,,,,,,,,,,,,,,,,,,,,,,,,,,
1289,flights from boston to pittsburgh,boston,,pittsburgh,,,,,,,,,,,,,,,,,,,,,,,,,,,,,,,,,,,,,,,,,,,,,,,,,,,,,,,,,,,,,,,,,,,,,,,,,,,,
1290,i 'm looking for ground transportation in dallas,,,,,,,,,,,,,dallas,,,,,,,,,,,,,,,,,,,,,,,,,,,,,,,,,,,,,,,,,,,,,,,,,,,,,,,,,,,,,,,,,,
1291,is there a flight from atlanta to san francisco that stops over in denver,atlanta,,san francisco,,,,,,,,,,,denver,,,,,,,,,,,,,,,,,,,,,,,,,,,,,,,,,,,,,,,,,,,,,,,,,,,,,,,,,,,,,,,,,
1292,what is the earliest flight between boston and washington,boston,,washington,,,,,,,,,,,,,,,,,,,,,,,,,,,earliest,,,,,,,,,,,,,,,,,,,,,,,,,,,,,,,,,,,,,,,,,,,,,,,,,
1293,first class american flight from philadelphia to dallas on wednesday,philadelphia,,dallas,,,wednesday,,,,,,,,,,,first class,,american,,,,,,,,,,,,,,,,,,,,,,,,,,,,,,,,,,,,,,,,,,,,,,,,,,,,,,,,,,,,
1294,i 'd need information please on a flight from washington dc san francisco california,san francisco,,,,,,,,,,,,,,,,,,,,,,,,,,,,,,,,,,,,,,,,,,,,,,,,,,,,california,,,,,,dc,,,,,,,,,,,,,,,,,,,,
1295,i 'd like flight information between boston and washington september third,boston,,washington,,,,,,,,,,,,,,,,,,,,,,third,september,,,,,,,,,,,,,,,,,,,,,,,,,,,,,,,,,,,,,,,,,,,,,,,,,,,,,
1296,list daily flights from atlanta to denver,atlanta,,denver,,,,,,,,,,,,,,,,,,,,,,,,,,,,,,,,,,,,,,,,,,,,,daily,,,,,,,,,,,,,,,,,,,,,,,,,,,,,,,
1297,all flights from baltimore to philadelphia less than 1000 dollars,baltimore,,philadelphia,,,,,,less,,1000 dollars,,,,,,,,,,,,,,,,,,,,,,,,,,,,,,,,,,,,,,,,,,,,,,,,,,,,,,,,,,,,,,,,,,,,
1298,show me the flights from san francisco to boston on august thirty first,san francisco,,boston,,,,,,,,,,,,,,,,,,,,,,thirty first,august,,,,,,,,,,,,,,,,,,,,,,,,,,,,,,,,,,,,,,,,,,,,,,,,,,,,,
1299,show flights between boston and philadelphia,boston,,philadelphia,,,,,,,,,,,,,,,,,,,,,,,,,,,,,,,,,,,,,,,,,,,,,,,,,,,,,,,,,,,,,,,,,,,,,,,,,,,,
1300,what limousine service is in boston,,,,,,,,,,,,,boston,,,,,,,,,,,,,,,,limousine,,,,,,,,,,,,,,,,,,,,,,,,,,,,,,,,,,,,,,,,,,,,,,,,,,
1301,what are the flights from las vegas to burbank also on saturday may twenty two,las vegas,,burbank,,,saturday,,,,,,,,,,,,,,,,,,,twenty two,may,,,,,,,,,,,,,,,,,,,,,,,,,,,,,,,,,,,,,,,,,,,,,,,,,,,,,
1302,how many united flights are there to san francisco,,,san francisco,,,,,,,,,,,,,,,,united,,,,,,,,,,,,,,,,,,,,,,,,,,,,,,,,,,,,,,,,,,,,,,,,,,,,,,,,,,,,
1303,show me the flights into love field,,,,,,,,,,,,,,,,,,,,,,,,,,,,,,,,,,,,,,,,,,,,,,,,,love field,,,,,,,,,,,,,,,,,,,,,,,,,,,,,,
1304,what are the rental car rates in san francisco,,,,,,,,,,,,,san francisco,,,,,,,,,,,,,,,,rental car,,,,,,,,,,,,,,,,,,,,,,,,,,,,,,,,,,,,,,,,,,,,,,,,,,
1305,san francisco to boston please with a stopover in denver,san francisco,,boston,,,,,,,,,,,denver,,,,,,,,,,,,,,,,,,,,,,,,,,,,,,,,,,,,,,,,,,,,,,,,,,,,,,,,,,,,,,,,,
1306,i would like to see the flights from denver to philadelphia,denver,,philadelphia,,,,,,,,,,,,,,,,,,,,,,,,,,,,,,,,,,,,,,,,,,,,,,,,,,,,,,,,,,,,,,,,,,,,,,,,,,,,
1307,please list all flights on united airlines and northwest which go to denver,,,denver,,,,,,,,,,,,,,,,northwest,,,,,,,,,,,,,,,,,,,,,,,,,,,,,,,,,,,,,,,,,,,,,,,,,,,,,,,,,,,,
1308,i 'm traveling to dallas from philadelphia,philadelphia,,dallas,,,,,,,,,,,,,,,,,,,,,,,,,,,,,,,,,,,,,,,,,,,,,,,,,,,,,,,,,,,,,,,,,,,,,,,,,,,,
1309,list the total number of flights to all airports by delta,,,,,,,,,,,,,,,,,,,delta,,,,,,,,,,,,,,,,,,,,,,,,,,,,,,,,,,,,,,,,,,,,,,,,,,,,,,,,,,,,
1310,i need to book a flight from newark to tampa on april fourth,newark,,tampa,,,,,,,,,,,,,,,,,,,,,,fourth,april,,,,,,,,,,,,,,,,,,,,,,,,,,,,,,,,,,,,,,,,,,,,,,,,,,,,,
1311,show me all flights between san francisco and philadelphia for september fifteenth,san francisco,,philadelphia,,,,,,,,,,,,,,,,,,,,,,fifteenth,september,,,,,,,,,,,,,,,,,,,,,,,,,,,,,,,,,,,,,,,,,,,,,,,,,,,,,
1312,all flights from san francisco to los angeles,san francisco,,los angeles,,,,,,,,,,,,,,,,,,,,,,,,,,,,,,,,,,,,,,,,,,,,,,,,,,,,,,,,,,,,,,,,,,,,,,,,,,,,
1313,is there a flight on continental airlines from boston to denver,boston,,denver,,,,,,,,,,,,,,,,continental airlines,,,,,,,,,,,,,,,,,,,,,,,,,,,,,,,,,,,,,,,,,,,,,,,,,,,,,,,,,,,,
1314,what flight from denver to pittsburgh arrives earliest in the morning,denver,,pittsburgh,,morning,,,,,,,,,,,,,,,,,,,,,,,,,,,,,,,,,,,,,,,,,,earliest,,,,,,,,,,,,,,,,,,,,,,,,,,,,,,,,
1315,when is the earliest flight from boston to denver,boston,,denver,,,,,,,,,,,,,,,,,,,,,,,,,,,earliest,,,,,,,,,,,,,,,,,,,,,,,,,,,,,,,,,,,,,,,,,,,,,,,,,
1316,what 's a flight that goes from baltimore to seattle,baltimore,,seattle,,,,,,,,,,,,,,,,,,,,,,,,,,,,,,,,,,,,,,,,,,,,,,,,,,,,,,,,,,,,,,,,,,,,,,,,,,,,
1317,what 's the first flight from boston to san francisco,boston,,san francisco,,,,,,,,,,,,,,,,,,,,,,,,,,,first,,,,,,,,,,,,,,,,,,,,,,,,,,,,,,,,,,,,,,,,,,,,,,,,,
1318,please give grounds transportation at dallas airport,,,,,,,,,,,,,,,,,,,,,,,,,,,,,,,,,,,,,,,,,,,,,,,,,,,,,,,,,,,,,,dallas airport,,,,,,,,,,,,,,,,,
1319,what is the latest afternoon flight i can get from dallas to san francisco on first class,dallas,,san francisco,,,,afternoon,,,,,,,,,,first class,,,,,,,,,,,,,latest,,,,,,,,,,,,,,,,,,,,,,,,,,,,,,,,,,,,,,,,,,,,,,,,,
1320,what is restriction ap 57,,,,,,,,,,,,,,,,,,,,,,,,,,,,,,,,,,,,,,,,,,,,,,,,,,,,,,,,,,,,,ap 57,,,,,,,,,,,,,,,,,,
1321,what is the earliest flight from boston that will arrive in denver,boston,,denver,,,,,,,,,,,,,,,,,,,,,,,,,,,earliest,,,,,,,,,,,,,,,,,,,,,,,,,,,,,,,,,,,,,,,,,,,,,,,,,
1322,what is the earliest arrival in salt lake city of a flight from toronto,toronto,,salt lake city,,,,,,,,,,,,,,,,,,,,,,,,,,,earliest,,,,,,,,,,,,,,,,,,,,,,,,,,,,,,,,,,,,,,,,,,,,,,,,,
1323,and what is the last flight from denver to boston for tomorrow evening,denver,,boston,,,,evening,,,,,tomorrow,,,,,,,,,,,,,,,,,,last,,,,,,,,,,,,,,,,,,,,,,,,,,,,,,,,,,,,,,,,,,,,,,,,,
1324,please show all flights from philadelphia to denver airport next sunday,philadelphia,,,,,sunday,,,,,,,,,,,,next,,,,,,,,,,,,,,,,,,,,,,,,,,,,,,,denver airport,,,,,,,,,,,,,,,,,,,,,,,,,,,,,,
1325,all flights and fares from pittsburgh to dallas round trip after 12 pm less than 1100 dollars,pittsburgh,12 pm,dallas,,,,,,less,round trip,1100 dollars,,,,,after,,,,,,,,,,,,,,,,,,,,,,,,,,,,,,,,,,,,,,,,,,,,,,,,,,,,,,,,,,,,,,,
1326,show me all fares between philadelphia and san francisco that are less than 200 dollars one way,philadelphia,,san francisco,,,,,,less,one way,200 dollars,,,,,,,,,,,,,,,,,,,,,,,,,,,,,,,,,,,,,,,,,,,,,,,,,,,,,,,,,,,,,,,,,,,,
1327,show me fares leaving on tuesdays from denver to dallas,denver,,dallas,,,tuesdays,,,,,,,,,,,,,,,,,,,,,,,,,,,,,,,,,,,,,,,,,,,,,,,,,,,,,,,,,,,,,,,,,,,,,,,,,
1328,i want wednesday flights from atlanta to washington dc,atlanta,,washington,,,wednesday,,,,,,,,,,,,,,,,,,,,,,,,,,,,dc,,,,,,,,,,,,,,,,,,,,,,,,,,,,,,,,,,,,,,,,,,,,,
1329,are they all nonstop flights from kansas city to st. paul,kansas city,,st. paul,,,,,,,,,,,,,,,,,,,,,,,,,,,,,,,,,,,,,nonstop,,,,,,,,,,,,,,,,,,,,,,,,,,,,,,,,,,,,,,,
1330,okay show me all the flights to baltimore,,,baltimore,,,,,,,,,,,,,,,,,,,,,,,,,,,,,,,,,,,,,,,,,,,,,,,,,,,,,,,,,,,,,,,,,,,,,,,,,,,,
1331,flights from pittsburgh to baltimore between 10 am and 2 pm,pittsburgh,,baltimore,,,,,,,,,,,,,,,,,,10 am,2 pm,,,,,,,,,,,,,,,,,,,,,,,,,,,,,,,,,,,,,,,,,,,,,,,,,,,,,,,,,
1332,i 'd like a return flight from denver to atlanta evening flights,denver,,atlanta,,,,evening,,,,,,,,,,,,,,,,,,,,,,,,,,,,,,,,,,,,,,,,,,,,,,,,,,,,,,,,,,,,,,,,,,,,,,,,
